id,text_clean,target,len_text,count_word_uniques,text_contain_keyword_norm,contain_link_norm,contain_question_norm,contain_hashtag_norm
1,deeds reason earthquake may allah forgive us,1,69,13,1,0,0,1
4,forest fire near la ronge sask canada,1,38,7,1,0,0,0
5,residents asked shelter place notified officers evacuation shelter place orders expected,1,133,22,1,0,0,0
6,13000 people receive wildfires evacuation orders california,1,65,9,1,0,0,1
7,got sent photo ruby alaska smoke wildfires pours school,1,88,17,1,0,0,1
8,rockyfire update california hwy 20 closed directions due lake county fire cafire wildfires,1,110,18,1,0,0,1
10,flood disaster heavy rain causes flash flooding streets manitou colorado springs areas,1,95,14,1,0,0,1
13,im top hill see fire woods,1,59,15,1,0,0,0
14,theres emergency evacuation happening building across street,1,79,12,1,0,0,0
15,im afraid tornado coming area,1,52,10,1,0,0,0
16,three people died heat wave far,1,43,9,1,0,0,0
17,haha south tampa getting flooded hah wait second live south tampa gon na gon na fvck flooding,1,129,27,1,0,0,1
18,raining flooding florida tampabay tampa 18 19 days ive lost count,1,76,13,1,0,0,1
19,flood bago myanmar arrived bago,1,39,7,1,0,0,1
20,damage school bus 80 multi car crash breaking,1,56,12,1,0,0,1
23,whats man,0,14,3,1,0,1,0
24,love fruits,0,13,3,1,0,0,0
25,summer lovely,0,16,3,1,0,0,0
26,car fast,0,17,5,1,0,0,0
28,goooooooaaaaaal,0,28,3,1,0,0,0
31,ridiculous,0,22,3,1,0,0,0
32,london cool,0,17,4,1,0,0,0
33,love skiing,0,11,2,1,0,0,0
34,wonderful day,0,21,4,1,0,0,0
36,looooool,0,8,1,1,0,0,0
37,wayi cant eat shit,0,30,6,1,0,0,0
38,nyc last week,0,21,5,1,0,0,0
39,love girlfriend,0,18,3,1,0,0,0
40,cooool,0,9,2,1,0,0,0
41,like pasta,0,18,4,1,0,1,0
44,end,0,8,2,1,0,0,0
48,bbcmtd wholesale markets ablaze,1,55,5,1,1,0,0
49,always try bring heavy metal rt,0,67,10,0,1,0,1
50,africanbaze breaking newsnigeria flag set ablaze aba,1,82,9,1,1,0,1
52,crying set ablaze,0,34,7,1,0,0,0
53,plus side look sky last night ablaze,0,76,13,1,1,0,0
54,phdsquares mufc theyve built much hype around new acquisitions doubt set epl ablaze season,0,122,21,1,0,0,1
55,inec office abia set ablaze,1,55,8,1,1,0,0
56,barbados bridgetown jamaica ûò two cars set ablaze santa cruz ûó head st elizabeth police superintende,1,140,20,1,1,0,1
57,ablaze lord,0,22,5,1,0,0,0
59,check nsfw,0,114,8,0,1,0,1
61,outside youre ablaze alive youre dead inside,0,61,10,1,0,0,0
62,awesome time visiting cfc head office ancop site ablaze thanks tita vida taking care us,0,120,24,1,0,1,0
63,soooo pumped ablaze southridgelife,0,44,6,1,0,1,0
64,wanted set chicago ablaze preaching hotel,0,92,14,1,1,0,0
65,gained 3 followers last week know stats grow,0,96,16,0,1,1,0
66,west burned thousands wildfires ablaze california alone,1,97,13,1,1,0,0
67,building perfect tracklist life leave streets ablaze,0,63,10,1,0,0,0
68,check nsfw,0,114,8,0,1,0,1
71,first night retainers quite weird better get used wear every single night next year least,0,138,27,0,0,0,0
73,deputies man shot brighton home set ablaze,1,73,9,1,1,0,0
74,man wife get six years jail setting ablaze niece,1,75,10,1,1,0,0
76,santa cruz ûó head st elizabeth police superintendent lanford salmon r,0,134,18,0,1,0,0
77,police arsonist deliberately set black church north carolinaåêablaze,1,95,10,1,1,0,0
78,noches elbestia alexissanchez happy see teammates training hard goodnight gunners,0,130,15,0,1,1,0
79,kurds trampling turkmen flag later set ablaze others vandalized offices turkmen front diyala,1,135,19,1,1,0,1
80,truck ablaze r21 voortrekker ave outside tambo intl cargo section,1,97,13,1,1,0,0
81,set hearts ablaze every city gift every skyline like kiss upon lips û,0,124,22,1,1,0,0
82,sky ablaze tonight los angeles im expecting ig fb filled sunset shots know peeps,0,119,24,1,0,0,0
83,west burned thousands wildfires ablaze california alone climate energy,1,138,16,1,1,0,1
85,revel wmv videos means mac farewell ablaze wmv en route dvd gtxrwm,0,85,17,1,0,0,0
86,progressive greetings month students would set pens ablaze torch publications,0,135,17,1,1,0,0
89,rene ablaze amp jacinta secret 2k13 fallen skies edit mar 30 2013,0,98,16,1,1,0,0
91,navista7 steve fires something else california tinderbox clown setting hood ablaze news24680,1,138,23,1,0,0,0
92,nowplaying rene ablaze amp ian buff magnitude edm,0,80,11,1,1,0,1
93,nxwestmidlands huge fire wholesale markets ablaze,1,76,8,1,1,0,0
95,ablaze time talk go dont know make due work,0,85,19,1,0,1,0
96,cant kids cuz got bicycle accident amp split testicles impossible kids michael father,0,140,27,1,0,0,0
97,accident i24 w nashvilletraffic traffic moving 8m slower usual,1,98,12,1,1,0,1
98,accident center lane blocked santaclara us101 nb great america pkwy bayarea traffic,1,123,16,1,1,0,1
100,personalinjury accident summer read advice amp see solicitor help otleyhour,0,129,18,1,1,1,1
102,stlouis caraccidentlawyer speeding among top causes teen accidents car accident teeû,0,139,14,1,1,0,1
104,reported motor vehicle accident curry herman rd near stephenson involving overturned vehicle please use,1,139,18,1,1,0,0
105,bigrigradio live accident awareness,1,35,4,1,0,0,0
107,i77 mile marker 31 south mooresville iredell vehicle accident ramp closed 86 118 pm,1,90,16,1,0,0,0
109,rt sleepjunkies sleeping pills double risk car accident,0,90,12,1,1,0,0
110,accident knew gon happen,0,67,9,1,1,0,0
112,traffic accident n cabrillo hwymagellan av mir 080615 110358,1,67,9,1,0,0,0
113,i77 mile marker 31 40 south mooresville iredell vehicle accident congestion 86 118 pm,1,95,17,1,0,0,0
114,pastor scene accidentwho owner range rover,1,91,18,1,0,1,0
117,mom didnt get home fast wished mom accident truck spilt mayonnaise,0,142,26,1,0,1,0
118,horrible car accident past sunday im finally able get around thank god,1,98,19,1,0,1,0
119,wait see pissed donnie tell another accident,0,80,17,1,0,1,0
120,truckcrash overturns fortworth interstate click youve crashgt,1,132,14,0,1,0,1
121,accident ashville us 23 sb sr 752 traffic,1,79,12,1,1,0,1
126,carolina accident motorcyclist dies i540 crash car crossed median motorcycle rider traveling,1,136,17,1,1,0,0
128,fyi cadfyi accident property damagenhs999 piner rdhorndale dr,1,67,8,1,0,0,0
129,rt naayf first accident years turning onto chandanee magu near mma taxi rammed halfway turned everyone confû,1,142,24,1,0,0,0
130,accident left lane blocked manchester rt 293 nb eddy rd stop go traffic back nh3a delay 4 mins traffic,1,128,25,1,0,0,1
131,accident property damage piner rdhorndale dr,1,47,6,1,0,0,0
132,accident,0,46,6,1,1,1,0
133,fyi cadfyi accident property damagewpd1600 17th st,1,57,8,1,0,0,0
134,862015209 pm traffic accident injury 2781 willis foreman rd,1,93,12,1,1,0,0
135,aashiqui actress anu aggarwal nearfatal accident,1,79,9,1,1,0,0
136,suffield alberta accident,1,49,4,1,1,0,0
137,9 mile backup i77 southaccident blocking right 2 lanes exit 31 langtree rdconsider nc 115 nc 150 nc 16 alternate,1,138,26,1,0,0,0
138,accident changed life help determine options financially support life care plans ongoing treatment,0,138,22,1,0,1,0
139,breaking deadly motorcycle car accident happened hagerstown today ill details 5 your4state whag,1,136,21,1,0,0,1
141,flowri marinading accident,0,53,10,1,0,1,0
143,car even week got fucking car accident mfs cant fucking drive,1,97,22,1,0,0,0
144,norwaymfa bahrain police previously died road accident killed explosion,1,124,17,1,1,0,1
145,still heard church leaders kenya coming forward comment accident issue disciplinary measuresarrestpastornganga,0,139,20,1,0,0,1
146,aftershockdelo scuf ps live game cya,0,49,8,1,0,0,0
149,man drive effort gets painful man win roger bannister,0,110,20,0,0,0,0
151,320 ir icemoon aftershock djicemoon dubstep trapmusic dnb edm dance icesû,0,138,16,1,1,0,1
153,victory bargain basement prices dwight david eisenhower,0,73,11,0,0,0,0
156,320 ir icemoon aftershock djicemoon dubstep trapmusic dnb edm dance icesû,0,138,16,1,1,0,1
157,nobody remembers came second charles schulz,0,53,8,0,0,0,0
158,aftershockdelo im speaking someone using scuf xb1 people end getting ps also,0,125,24,1,0,0,0
159,harder conflict glorious triumph thomas paine,0,69,11,0,0,0,0
160,growingupspoiled going clay pigeon shooting crying aftershock,0,83,11,1,0,0,1
161,guess one actually wants free aftershock tc,0,60,11,1,0,0,0
162,aftershock terrifying best roller coaster ive ever disclaimer ive,0,109,18,1,0,0,0
163,aftershock,0,34,2,1,1,0,0
164,320 ir icemoon aftershock djicemoon dubstep trapmusic dnb edm dance icesû,0,138,16,1,1,0,1
165,320 ir icemoon aftershock djicemoon dubstep trapmusic dnb edm dance icesû,0,138,16,1,1,0,1
168,320 ir icemoon aftershock djicemoon dubstep trapmusic dnb edm dance icesû,0,138,16,1,1,0,1
170,kjfordays im seeing issues aftershock,0,54,9,1,0,1,0
171,320 ir icemoon aftershock djicemoon dubstep trapmusic dnb edm dance icesû,0,138,16,1,1,0,1
172,320 ir icemoon aftershock djicemoon dubstep trapmusic dnb edm dance icesû,0,138,16,1,1,0,1
173,wisdomwed bonus 5 minute daily habits could really improve life many already lifehacks,0,139,21,0,1,1,1
174,aftershock protect profit next global financial meltdown david wiedemer http,0,123,16,1,1,0,0
175,moment get scary roller coaster guy behind screaming bloody murder silverwood aftershock,0,136,23,1,0,1,1
176,aftershock ã¢ 2010 fullã¢ streaming youtube,0,72,8,1,1,0,0
178,gtgt 15 aftershock protect profit next global financial book esquireattire,0,130,15,1,1,0,1
180,sometimes face difficulties youre something wrong youre something right joel osteen,0,128,19,0,0,0,0
182,thing stands dream try belief actually possible joel brown,0,132,26,0,0,0,0
183,praise god ministry tells like wdyouth biblestudy,0,110,16,0,1,0,1
184,remembering going die best way know avoid trap thinking something lose ûò steve jobs,0,135,27,0,0,0,0
185,tried orange aftershock today life never,0,61,11,1,0,0,0
187,onfireanders love bb,0,27,5,0,0,0,0
190,aftershock,0,34,2,1,1,0,0
191,aftershock back school kick great want thank everyone making possible great night,0,114,21,1,0,0,0
193,people say done interrupt ûò george bernard shaw,0,101,19,0,0,0,0
194,first man gets oyster second man gets shell andrew carnegie,0,78,14,0,0,0,0
195,anyone need pu tonight play hybrid slayer ps4 eu hmu cod8sandscrims empirikgaming codawscrims 4tpkotc 4tpfa aftershockorg,0,136,18,1,0,1,0
196,experts france begin examining airplane debris found reunion island french air accident experts news,1,136,18,0,1,0,1
197,strict liability context airplane accident pilot error common component aviation cr,1,136,20,1,1,0,0
198,crobscarla lifetime odds dying airplane accident 1 8015,0,80,14,1,0,0,0
199,experts france begin examining airplane debris found reunion island french air accident experts wedn,1,136,18,0,1,0,0
201,alexalltimelow theyre airplane accident theyre gon na die cuties good job,1,104,17,1,0,1,0
203,family members osama bin laden died airplane accident ironic mhmmm gov shit suspect,1,110,20,1,0,1,0
204,man goes airplane engine accident via youtube,1,75,9,0,1,0,0
205,horrible accident man died wings airplane 29072015,1,84,11,0,1,0,0
208,cessna airplane accident ocampo coahuila mexico july 29 2015 killed four men including state coahuila government official,1,135,22,1,0,0,0
209,horrible accident man died wings airplane 29072015 watchthevideo,1,97,10,0,1,0,1
210,experts france begin examining airplane debris found reunion island french air accident experts wednesdayû,1,140,18,0,1,0,0
211,experts france begin examining airplane debris found reunion island french air accident experts wednesday began examining,1,136,20,0,0,0,0
212,kca votejkt48id mbataweel rip binladen family members killed airplanes accident,1,95,13,0,0,0,1
213,almost sent coworker nudes accident thank god airplane mode,0,71,13,0,0,0,0
215,mickinyman theatlantic might killed airplane accident night car wreck politics best,0,126,22,1,0,0,0
216,experts france begin examining airplane debris found reunion island french air accident experts mlb,1,136,18,0,1,0,1
218,unbelievably insane man airport airplane aircraft aeroplane runway accident freakyû,1,126,12,0,1,0,1
219,horrible accident man died wings airplaneåê29072015,1,87,11,0,1,0,0
220,horrible accident man died wings airplane 29072015,1,83,10,0,1,0,0
221,usama bin ladins family dead airplane crash naturally accident,1,70,11,0,0,0,0
222,pilot dies plane crash car festival via youtube crash aircraft airplane pilot death accident carfest,1,138,18,0,1,0,1
225,strict liability context airplane accident,1,80,11,1,1,0,0
226,dtn brazil experts france begin examining airplane debris found reunion island french air accident exp,1,136,18,0,1,0,0
229,experts france begin examining airplane debris found reunion island french air accident experts wedn,1,136,18,0,1,0,0
231,horrible accident man died wings ûïairplaneû 29072015 wtf canûªt believe eyes ûò,1,129,17,0,1,0,0
232,nicole fletcher one victim crashed airplane times ago accident left little bit trauma although shes,1,136,25,0,0,0,0
235,omg horrible accident man died wings airplane,1,75,10,0,1,0,0
237,omg dont believe rip bro airplane accident jetengine turbojet boing g90,1,112,13,0,1,0,1
238,experts france begin examining airplane debris found reunion island french air accident experts wednesday began examining,1,136,20,0,0,0,0
240,airplane accident,1,26,5,1,0,0,0
241,phone looks like car ship airplane accident terrible,0,68,13,1,0,0,0
242,statistically im risk getting killed cop dying airplane accident,0,104,21,1,0,0,0
243,airplane crashes house colombia 12 people die accident,1,87,12,0,1,0,0
244,shooting airplane accident,1,62,8,1,1,0,0
245,could drone cause airplane accident pilots worried use drones esp close vicinity airports,1,136,21,1,1,1,1
246,early wake call sister begging come amp ride wher ambulance hospital rodkiai,1,116,22,1,0,0,1
247,twelve feared killed pakistani air ambulance helicopter crash,1,110,11,1,1,0,0
248,two air ambulances scene serious crash two cars lorry emsneû,1,138,20,1,1,0,1
249,twelve feared killed pakistani air ambulance helicopter crash reuters yugvani,1,106,13,1,1,0,1
251,leading emergency services boss welcomes new ambulance charity,0,85,9,1,1,0,0
252,anyone travelling aberystwythshrewsbury right theres incident services halt outside shrews ambulance scene,1,136,19,1,0,0,0
253,twelve feared killed pakistani air ambulance helicopter crash,1,87,10,1,1,0,0
254,ambulance sprinter automatic frontline vehicle choice 14 lez compliant ebay,0,103,13,1,1,0,0
256,new nanotech device able target destroy blood clots,0,89,13,0,1,0,0
258,20skyhawkmm20 traplord29 fredosantana300 lilreese300 hella crazy 3 fights ambulance couple mosh pits,1,124,18,1,0,1,0
260,get run ambulance lucky justsaying randomthought,0,72,13,1,0,1,1
261,news twelve feared killed pakistani air ambulance helicopter crash tilnow dna,1,107,13,1,1,0,1
262,twelve feared killed pakistani air ambulance helicopter crash,1,110,11,1,1,0,0
263,tanslash waiting ambulance,0,34,5,1,0,0,0
264,fouseytube ok need ambulance hahahah good,0,83,11,1,1,1,0
265,ambulance sprinter automatic frontline vehicle choice 14 lez compliant ebay,0,103,13,1,1,0,0
266,pakistan air ambulance helicopter crash kills nine,1,73,8,1,1,0,0
267,thenissonian rejectdcartoons nissan ok need medical assistance call ambulance need,0,121,21,1,0,0,0
268,ems1 ny emts petition 17 per hour û÷minimum wageûª ems paramedics ambulance,0,109,14,1,1,0,1
269,twelve feared killed pakistani air ambulance helicopter crash,1,110,11,1,1,0,0
270,twelve feared killed pakistani air ambulance helicopter crash,1,87,10,1,1,0,0
271,ambulance sprinter automatic frontline vehicle choice 14 lez compliant ebay,0,103,13,1,1,0,0
272,ambulance sprinter automatic frontline vehicle choice 14 lez compliant ebay,0,103,13,1,1,0,0
273,kiwikaryn check whats parking lot said last year ambulance st johns,0,133,22,1,1,0,0
274,dont know way ambulance coming ltlt,1,66,12,1,0,0,0
276,reuters twelve feared killed pakistani air ambulance helicopter crash,1,96,11,1,1,0,1
277,twelve feared killed pakistani air ambulance helicopter crash,1,110,11,1,1,0,0
279,ambulance right outside work,0,47,9,1,0,0,0
280,ûïleoblakecarter dog thinks hes ambulance,0,102,9,1,1,1,0
281,happening hatzolah ems ambulance responding dual sirens andû,0,97,12,1,1,0,0
283,twelve feared killed pakistani air ambulance helicopter crash,1,110,11,1,1,0,0
285,twelve feared killed pakistani air ambulance helicopter crash,1,110,11,1,1,0,0
287,twelve feared killed pakistani air ambulance helicopter crash worldnews,1,98,11,1,1,0,1
289,twelve feared killed pakistani air ambulance helicopter crash worldnews,1,98,11,1,1,0,1
290,whats police ambulance number lesotho body know,0,64,11,1,0,1,0
291,medic914 aaceorg surprised still standardised clinical practice across 11 nhs ambulance trust,0,120,18,1,0,0,0
293,twelve feared killed pakistani air ambulance helicopter crash,1,110,11,1,1,0,0
294,people try jwalk ambulance passing hate,0,69,13,1,0,0,0
296,episode trunks annihilated freiza cleanest shit ever showed nigga mercy,0,101,17,1,0,0,0
297,shall annihilated petebests dessicated laid bare shall kneel,0,110,19,1,0,0,0
298,uribe annihilated baseball mets,0,43,6,1,0,0,1
299,marksmaponyane heysundowns annihilated previous meeting celticindeed improvement,0,110,13,1,0,0,0
301,volfan326 tneazzy mizzou annihilated florida past 2 seasons even ended muschamps career cant compete bama,0,127,19,1,0,0,0
302,annihilated abs,1,43,5,1,1,1,0
303,annihilated status education mba behalf easy street careen eovm,0,105,16,1,1,0,0
307,luka die everything annihilated alois trancy,0,82,14,1,0,0,0
309,acarewornheart good un fella sorry wont get annihilated,0,90,17,1,0,0,0
310,cop pulls drunk driver safety seconds car hit train via viralspell,1,136,18,0,1,0,0
312,must annihilated,0,24,4,1,0,0,0
313,cop pulls drunk driver safety seconds car hit train via viralspell,1,136,18,0,1,0,0
314,boom country entirely annihilated hû ûó britain,0,94,13,1,1,0,0
315,amirkingkhan would annihilated might well thank floydmayweather,0,89,13,1,0,0,0
316,one thing suregod promised israel annihilated butthe horror iran wnukes,0,125,17,1,1,0,0
318,violentfeminazi guess thats ok armenians since weve spent history getting annihilated,1,106,16,1,0,0,0
320,70 years since annihilated 100000 people instantly became aware ability annihilate whole humanity,1,131,22,1,0,0,0
321,day 1 tryouts went good minus fact stopped quickly get short ball annihilated toenail injury even,0,123,24,1,0,0,0
322,1960s oryx symbol arabian peninsula annihilated hunters,1,135,17,1,1,0,0
327,luka die everything annihilated alois trancy,0,86,15,1,0,0,0
328,ready get annihilated bucs game,1,42,8,1,0,0,0
329,philipduncan breakfastone people annihilated last nights weather really philip thought would forecast,1,128,16,1,0,0,0
330,domain sophistication annihilated closely uptotheminute feat zrnf,0,78,9,1,0,0,0
331,stormbeard steellord seen judas priest 2005 rob came back scorpions support fucking annihilated place astonishing gig,0,140,21,1,0,0,0
332,officially skipping fantasticfourfant4sticwhatever hashtag getting annihilated reviews bummer,0,122,14,1,0,0,1
334,tomcatarts thus explaining annihilated case survivor evolved became godlike,1,134,23,1,0,0,0
335,completely annihilated cech paul keegan time alive,0,73,13,1,0,0,0
336,tomcatarts annihilated legion survivors imperfect hybrid project quickly formed new secret cell,0,139,22,1,0,0,0
337,sirbrandonknt exactly thats lesnarcena match summerslam last year great brock annihilated guy whos,0,133,20,1,0,0,0
338,cop pulls drunk driver safety seconds car hit train via viralspell,1,136,18,0,1,0,0
340,annihilated damascus syrian army grinds û÷alloosh gang manure pile,1,111,14,1,1,0,0
341,thatdes ok wasnt completely forthright may also food coma bc kebabtahinipickles also annihilated wfries,0,136,23,1,0,0,0
344,fun filled happyhour simmons bar camden handsome one got annihilated apart game,0,138,22,1,1,1,0
345,juanny beisbol sr annihilated ball lgm,0,46,7,1,0,0,1
346,rvfriedmann hell fraction belief total annihilation destruction usa lodisilverado ritzyjewels,1,120,17,0,0,0,0
347,potus maybe call israel tell sorry pres sold river annihilation,0,115,21,0,0,0,0
348,evildead annihilation civilization,0,62,6,0,1,0,0
349,us national park services tonto national forest stop annihilation salt river wild horse via change,0,138,19,0,1,0,0
352,annihilating quarterstaff annihilation,1,41,4,0,0,0,0
353,world annihilation vs self transformation aliens attack exterminate humans,0,123,12,0,1,0,0
354,starmade stardate 3 planetary annihilation via youtube,1,85,8,0,1,0,0
355,us national park services tonto national forest stop annihilation salt river wild horse via change,0,139,19,0,1,0,0
356,us national park services tonto national forest stop annihilation salt river wild horse via change,1,139,19,0,1,0,0
358,kimkardashian please sign share petition save wild horses arizona,0,118,17,0,1,1,0
360,us national park services tonto national forest stop annihilation salt river wild horse via change,1,138,19,0,1,0,0
361,theellenshow please check salt river horses help stop annihilation happen without 54000 signatureschange org thx,0,138,20,0,0,0,0
363,souls punished withåêannihilation,0,84,6,0,1,1,0
364,calfreedommom steph93065 mention major contributor annihilation israel,1,91,13,0,0,0,0
365,willienelson need help horses dieplease rt amp sign petitiontake stand amp voice gilbert23,1,148,21,0,1,0,1
368,reject laws misguided false prophets imprison nations fueling self annihilation,0,92,14,0,0,0,0
370,us national park services tonto national forest stop annihilation salt river wild horse via change,0,139,19,0,1,0,0
371,annihilation jeb christie amp kasich less 24 hours away please god allow least one full day,0,124,22,0,0,0,0
372,barbitwins need helphorses die please rt amp sign petition take stand amp voice gilbert23,0,148,22,0,1,0,1
375,whippenz need help horses dieplease rt amp sign petitiontake stand amp voice gilbert23,0,144,21,0,1,0,1
380,hey az sign petition save wildhorses tantonationalforest rollingstones singalong order,0,140,18,0,1,0,1
381,stop annihilation salt river wild horses via change,1,87,12,0,1,0,0
383,sonofbaldwin hes current nova bookslast checkedhe tied books 2011 rider died annihilation,0,139,23,0,0,0,0
384,us national park services tonto national forest stop annihilation salt river wild horse via change,0,139,19,0,1,0,0
386,please sign amp rt save saltriverwildhorses,0,95,9,0,1,0,1
389,thanks count dante join us following annihilation zone johnny,0,87,16,0,0,0,0
390,world annihilation vs self transformation aliens attack exterminate humans,1,123,12,0,1,0,0
393,us national park services tonto national forest stop annihilation salt river wild horse via change,0,139,19,0,1,0,0
394,us national park services tonto national forest stop annihilation salt river wild horse via change,1,138,19,0,1,0,0
396,im gon na fight taylor soon get,0,46,10,0,0,0,0
397,ohh fukurodani didnt survive apocalypse bokuto feels horrible poor boy ppor child,1,96,17,1,0,0,0
398,another jocelyn birthday apocalypse,0,49,7,1,0,0,0
401,rt janenelson097 rt stephenscifi adaptation watch charlie humans apocalypse optioned film sciencefiction û,0,126,16,1,0,0,1
402,apocalypse please,0,17,2,1,0,0,0
404,another hour august 05 2015 0802pm heres red rover zombie apocalypse 2014 internetradio collegeradiû,1,139,17,1,1,0,1
406,honeybunzgem primalkitchen feel like pullup one stages apocalypse,0,99,17,1,0,0,0
407,shes kinda hot played radio today whats next disease apocalypse started everyone careful,0,120,20,1,0,1,0
409,apocalypse lol gf m8,0,36,8,1,0,0,0
410,know question interpretation sign apocalypse called,1,115,20,1,1,0,0
412,julie r apocalypse version romeo juliet warmbodies,0,65,12,1,0,0,1
413,apocalypse upon us,0,25,5,1,0,0,0
415,rt fittscott minecraft night lucky block mod bob apocalypse wither 20 amp mod showcase popularmmos viû,0,142,18,1,1,0,0
418,begins day one snow apocalypse,1,49,10,1,0,0,0
419,rt ourmothermary short reading apocalypse 211023 spirit angel took top enormous high mountain û,0,139,22,1,0,0,0
420,candylit imagine sarumi zombie apocalypse fighting back back heart heart conversations,0,133,18,1,1,0,0
421,rt zonewolf123 liked youtube video minecraft night lucky block mod bob apocalypse wither 20 amp moû,0,142,20,1,1,0,0
423,thats planet lone audience apocalypse,0,73,13,1,0,0,0
424,dad bought dvd looks like science doc front read back actually impending biblical apocalypse,1,137,26,1,0,0,0
426,alexandrapullin indeed apocalypse comes week know ill,0,88,16,1,0,0,0
427,go look grizzly peak right looks like beginning dystopian apocalypse movie,0,97,17,1,0,0,0
429,niece asked would scared apocalypse,0,82,16,1,0,1,0
432,theres storm cairo latest xmen apocalypse set photo via yahootv,1,106,15,1,1,0,0
435,minecraft night lucky block mod bob apocalypse wither 20 amp mod showcase popularmmos via youtube,0,134,17,1,1,0,0
436,shot heart xv going totally give love bad name heart pierc,0,140,21,0,1,0,0
437,rt geekapocalypse 4pm gmt hesse plays dark souls 2 day 9 etcpb,0,114,14,1,1,0,1
438,know go zombies take,0,70,11,0,1,0,0
440,latest bryansinger reveals storm queen apocalypse rupaul alexshipppp,1,113,14,1,1,0,1
442,shadow boxing apocalypse,1,28,4,1,0,0,0
443,short reading apocalypse 211023 spirit angel took top enormous high mountain,1,137,20,1,1,0,0
444,enjoyed liveaction attack titan every time see posters im reminded freshly clean coiffed everyone apocalypse,0,138,23,1,0,0,0
445,liked youtube video minecraft night lucky block mod bob apocalypse wither 20 amp mod showcase,0,133,19,1,1,0,0
446,pbban temporary300 avysss armageddon kill flags fast xp reason,0,91,16,1,0,0,1
447,pbban temporary300 russaky89 armageddon kill flags fast xp reason,0,94,16,1,0,0,1
448,official vid doublecups gtgt gtgt trubgme prod thisizbwright gtgt armageddon,0,120,11,1,1,0,1
450,ouvindo peace love amp armageddon,0,35,5,1,0,0,0
