id,text_clean,target,len_text,count_word_uniques,text_contain_keyword_norm,contain_link_norm,contain_question_norm,contain_hashtag_norm
5034,ûïlittle boyû affected people hiroshima ûò eyewitness testimonials,1,104,12,1,1,0,0
5035,read schoolboyûªs eyewitness account hiroshima,1,75,8,1,1,0,0
5037,read eyewitness account hiroshima day 1945 life,1,93,13,1,1,0,1
5038,wftv eyewitness news tn school psychologist arrested florida child porn charges,0,109,14,1,1,0,0
5039,wake kern county eyewitness news mornings airing right kbak cbs29 liveonkbak,1,134,16,1,1,0,1
5040,anniversary hiroshima bombing illustrated timeline bombings eyewitness account particularly horrifying,1,135,14,1,1,0,0
5041,aug 06 2015 radio show articles ûò 1 eyewitness account abortion organ harvesting planned parenthood,0,135,19,1,1,0,0
5043,dk eyewitness travel guide denmark travel guide ebay auctions keep eye,0,113,16,1,1,0,0
5044,dk eyewitness travel guide denmark travel guide ebay auctions keep eye,0,113,16,1,1,0,0
5046,rt patrickjbutler excellent damiengayle eyewitness account kids company closure drop bomb expectû,1,140,17,1,1,0,0
5047,monkeys abused notorious laboratory dealer peta eyewitness invest via youtube,0,112,14,1,1,0,0
5049,true tbt eyewitness news wbre wyou,0,61,9,1,1,0,1
5050,dk eyewitness travel guide chicago dorling kindersley publishing staffû travel books ebay auctions,0,138,18,1,1,0,0
5052,lights stagetwo load shedding stagetwo load shedding force 5pm 10pm,0,137,20,0,1,0,0
5055,dk eyewitness travel guide denmark travel guide ebay auctions keep eye,0,113,16,1,1,0,0
5056,wftv eyewitness news fbi man stole us secrets married honduran minors sex,0,108,15,1,1,0,0
5059,freed bokoharam captives speak ûïi make sure goes school guardian,0,132,16,0,1,0,1
5060,tried save mido macia one murder accused testified tried save mido maciaûªs life,0,130,21,0,1,0,0
5061,russian food crematoria provoke outrage amid crisis famine memories moscow reuters russian government,1,135,16,1,1,0,0
5062,oct336 guys bitches aint famine,0,47,8,1,0,1,0
5063,food crematoria provoke outrage amid crisis famine memories,1,87,9,1,1,0,0
5064,russia food crematoria provoke outrage country wsoaring poverty soviet famine memory,1,138,14,1,1,0,1
5065,hunger hits cant function probably wouldnt last long famine zonesthank god,0,94,15,1,0,0,0
5067,according 2011 gallup poll money likely suffer time famine ariû,0,138,23,1,1,1,0
5068,ppl like unu feast today famine tomorrow,0,44,8,1,0,0,0
5069,top 3 turn darkness king redeem queen serene famine wolf,0,72,13,1,0,0,0
5071,russian food crematoria provoke outrage amid crisis famine memories,1,92,10,1,1,0,0
5072,robertmeyer9 example low food prices cause farmers go broke famine next year means simple capitalism failed feed peoplegt,0,141,22,1,0,0,0
5073,memorial millions perished holodomor erected us capital,1,140,19,0,1,0,0
5074,exporting food wont solve problem africans end famine n poverty solving control tribal wars,1,136,20,1,1,0,0
5075,food crematoria provoke outrage amid crisis famine memories,1,87,9,1,1,0,0
5076,new article russian food crematoria provoke outrage amid crisis famine memories read,1,123,16,1,1,0,0
5078,building muscle feast famine feeding diet plans based around losing weight youû,0,139,20,1,1,0,0
5079,famine coming end bluebell,1,63,9,1,1,0,1
5080,tasted like feast famine starving trusting jack writes4coffee iartg rwa tw4rw rrbc,0,139,20,1,1,0,1
5082,russian food crematoria provoke outrage amid crisis famine memories,1,92,10,1,1,0,0
5083,russia destroys food people go hungry ones insane government,1,119,17,0,1,0,0
5085,financialtimes ethiopian regimes continue receiving foreign aid famine struck 2 years eastern ethiopia,1,137,17,1,1,0,0
5087,reuters russian food crematoria provoke outrage amid crisis famine memories,1,124,12,1,1,0,0
5088,grade black horse faminemega score 0840728 dynamix,0,105,9,1,1,0,1
5089,russian û÷food crematoriaûª provoke outrage amid crisis famineåêmemories,1,97,9,1,1,0,0
5092,bolshevik government monopolized food supply seize power hunhry population artificial famine result,1,140,17,1,1,0,0
5094,russian food crematoria provoke outrage amid crisis famine memories via yahoonews,1,107,12,1,1,0,0
5095,ive experienced smell rotting potatoes first time famine must awful whole country smelled like,1,138,24,1,0,0,0
5096,russian food crematoria provoke outrage amid crisis famine memories,1,115,11,1,1,0,0
5097,things become terrible great ethiopian famine,0,67,10,1,0,0,0
5098,savagenation reminds peasants destroyed food stalins army came redistribute wealth caused faminedeath,1,140,20,1,0,0,0
5099,update 1russian food crematoria provoke outrage amid crisis famine memories russian society still recal,1,135,16,1,1,0,0
5101,adventures mineness 9 famine,1,73,12,1,1,0,1
5102,food crematoria russia provoke outrage amid crisis famine memories,1,94,10,1,1,0,0
5103,robert conquest famine museum kiev guidofawkes mediaguido,0,83,8,1,1,0,0
5104,russian food crematoria provokes outrage amid crisis famine memories,1,92,10,1,1,0,1
5105,cnn end times upon us famine war death plague presence growing stronger,0,93,17,1,0,0,0
5106,maratha raiders scorched lands amp punjab refused food aid 1943 famine wonder bengalis harbor hard feelings,1,141,22,1,0,0,0
5107,images famine ûò hope christ blog happens forget god hopeinchrist lifelettercafe,1,132,20,1,1,0,1
5109,surfphoto squeezed tear famine plague tsunami chance lego blubber,0,79,13,1,0,0,0
5110,russian food crematoria provoke outrage amid crisis famine memories yahoo news,1,105,13,1,1,0,0
5113,11yearold boy charged manslaughter toddler report 11yearold boy charged manslaughter fatal sh,1,136,20,1,0,0,0
5114,roger goodells fatal mistake tom brady innocent man,0,79,10,1,1,0,0
5115,boy 11 charged manslaughter shooting death elijah walker 11yearold appeared wednesday,1,134,18,0,1,0,0
5116,fatal attraction common n common pain,0,64,11,1,0,0,0
5117,apd investigating fatal shooting 3 year old child southeast anchorage,1,98,13,1,1,0,0
5119,investigators shift focus cause fatal waimate fire,1,79,10,1,1,0,0
5120,asianshawtyy im sorry im,0,48,7,0,0,1,0
5122,police man early 30s dies shooting vermont st,1,110,14,0,1,0,0
5124,man accused fatal hitandrun get new judge via khqa,0,82,12,1,1,0,0
5125,winnipeg police seek witnesses arlington william fatal crash,1,90,11,1,1,0,0
5126,chrisdanielshow nearlyfatal pee san francisco,0,73,7,1,1,0,0
5127,11yearold boy charged manslaughter toddler report 11yearold boy charged manslaughter fatal sh,1,136,20,1,0,0,0
5128,petition remaster fatal frame 1 windwakerstyle selfie mode,0,69,11,1,0,0,0
5130,11yearold boy charged manslaughter toddler report 11yearold boy charged manslaughter fatal sh,1,136,20,1,0,0,0
5131,man charged fatal crash near dubbo refused bail via dailyliberal,1,93,12,1,1,0,0
5132,california man facing manslaughter charge sundays wrongway fatal crash ca,1,137,16,1,1,0,0
5134,five fatal flaws iran deal via youtube,0,74,11,1,1,0,0
5135,stockton police investigating fatal driveby shooting north stockton,1,101,12,1,1,0,0
5136,deputies dog dispute leads fatal shooting person county gunfail nra,1,99,13,1,1,0,1
5137,11yearold boy charged manslaughter toddler report 11yearold boy charged manslaughter fatal sh,1,136,20,1,0,0,0
5138,ca cops illegal immigrant 4 prior arrests charged fatal sex attack,1,98,14,1,1,0,0
5139,spookyfob feelslikefob okay thank yes kindness fatal though like patrick stump level kindness,0,118,19,1,0,0,0
5140,11yearold boy charged manslaughter toddler report 11yearold boy charged manslaughter fatal sh,1,136,20,1,0,0,0
5141,success permanent amp failure fatal,0,52,9,1,0,0,0
5142,investigators shift focus cause fatal waimate fire,1,79,10,1,1,0,0
5144,11yearold boy charged manslaughter toddler report 11yearold boy charged manslaughter fatal sh,1,136,20,1,0,0,0
5145,11yearold boy charged manslaughter toddler report 11yearold boy charged manslaughter fatal sh,1,136,20,1,0,0,0
5146,tell adopt way maybe overlooked something fatal whyor,0,101,17,1,0,1,0
5148,boy 11 charged manslaughter shooting death elijah walker,1,90,12,0,1,0,0
5149,robert ballews log statements always fatal level,0,61,10,1,0,0,0
5150,fatal attraction,0,16,2,1,0,0,0
5152,news crimes police id victim fatal crash closed i65 near franklin one person justice courts,1,136,20,1,1,0,1
5153,11yearold boy charged manslaughter toddler report 11yearold boy charged manslaughter fatal sh,1,136,20,1,0,0,0
5154,investigators shift focus cause fatal waimate fire,1,79,10,1,1,0,0
5155,boy 11 charged fatal shooting 3yearold,1,69,9,1,1,0,0
5157,11yearold boy charged manslaughter toddler report 11yearold boy charged manslaughter fatal sh,1,136,20,1,0,0,0
5159,11yearold boy charged manslaughter toddler report 11yearold boy charged manslaughter fatal sh,1,136,20,1,0,0,0
5160,investigators shift focus cause fatal waimate fire,1,79,10,1,1,0,0
5162,exclusive 179 fatalities involving onduty nypd cops 15 years 3åêû,1,103,14,1,1,0,0
5164,nyc news legionnaires death toll rises 8 new york city eight fatalities older adults,1,136,21,1,1,0,1
5165,lets fraction vital need fatalities would break education econom,0,123,19,1,1,0,1
5166,las vegas top 5 cities redlight running fatalities news3lv,0,91,13,1,1,0,0
5168,totally unprepared emp attack china russia probably isis possess 90 fatalities pushing,1,135,23,1,0,1,0
5169,city implores motorists speed reports animal fatalities near nature reserves gt,1,126,16,1,1,0,0
5170,kyrikoni expressandstar said veg fruit good hope theres injuries fatalities,0,111,18,1,0,0,0
5171,understand fatalities one trapped inside wholesale market 8 fire engines 40 fire fighters scene,1,136,24,1,0,0,0
5172,6month mark total 662 fatalities 114 first half last year,1,129,24,1,1,0,0
5174,hse releases annual workplace facilities data look,0,107,12,0,1,0,1
5175,seattles deadliest red light runner intersections revealed,1,84,8,0,1,0,1
5176,5 rejected mortal kombat fatalities mortal kombat stretched boundaries itsû,0,135,15,1,1,0,0
5177,unsuckdcmetro minor train leaves rails major 11382 smithsonian interlocking derails amp crashes barrier wall w fatalities,1,136,18,1,0,0,0
5178,injuries illnesses fatalities latest numbers,1,73,8,1,1,0,0
5179,osage beach releases name,0,48,5,0,1,0,0
5180,wonder coolweird itll look characters mkx fatalities skinless predator,0,106,19,1,0,0,0
5181,saudi arabia abha fatalities reported following suicide bombing mosque avoid area,1,112,13,1,1,0,1
5182,use roads wisely prevent carnage continuinglet us fatalities holiday period ggindependencmessage,0,139,18,1,0,0,1
5183,mortal kombat fatalities gross interesting,0,53,8,1,0,0,0
5184,xrays mkx looking like fatalities,0,45,8,1,0,0,0
5185,dwilliams313 rt ieansquad donûªt know fatalities mortal kombat,0,112,16,1,1,0,0
5186,kitana fatalities slay ûókody vine kombatfans33,1,95,10,1,1,1,0
5187,osp concerned mounting fatalities,1,85,7,1,1,0,0
5188,mortal kombat x fatalities meat predator,0,73,8,1,1,0,0
5189,estimated damage fatalities hiroshimasized atomic bomb dropped hometown hiroshima70,1,129,17,1,1,0,1
5190,rcmp reporting fatalities serious injuries result collision tch near whitbourne,1,111,19,1,0,0,0
5191,govt allocating 13 bn flood action issue takes centre stage fatalities veneto,1,115,16,1,1,0,0
5192,zero spider biterelated fatalities australia since 1979,0,76,11,1,0,0,0
5193,liked youtube video tremor joke tremor dlc fatalitiesxray,1,99,13,1,1,0,0
5194,motordom lobbied change language around traffic fatalities need go back future visionzero,0,138,20,1,1,0,1
5195,sharing help cousins family,0,58,7,0,1,0,0
5196,among main factors behind pedestrian fatalities people failing yield car,1,115,16,1,1,0,0
5197,mortal kombat x excellent fatalities fun iûªve ever mortal kombat segas version,0,134,21,1,1,0,0
5198,uber reduces drunk driving fatalities says independent study,0,83,9,1,1,0,0
5199,liked youtube video kevinedwardsjr mortal kombat x pc gameplay fatalitiesxrays mkx,0,124,17,1,1,0,0
5200,las vegas top 5 cities redlight running fatalities,1,81,11,1,1,0,0
5201,rcmp confirm fatalities twovehicle crash tch remains closed whitbourne due accident,1,117,15,1,1,0,0
5202,american casualties including 400000ûò800000 fatalities five ten million japanese fatalities,1,129,13,1,1,0,0
5203,uk train accident fatalities 8th year running despite 4 increase passenger journeys healthandsafety,1,134,17,1,1,0,0
5204,fail see would bring number road fatalities immensely,0,83,16,1,0,0,0
5206,policylab cecanfs last public hearing nyc today tomorrow address child abuse neglect fatalities,1,140,20,1,1,0,0
5207,kurtschlichter yep considering millions japanese fatalities projected downfall freemarketeer dibang,1,124,14,1,0,0,0
5208,shipping logistics enca fatalities migrant boat capsizes med hundreds onboard û capsized,1,139,21,1,1,0,1
5209,message boards display updated traffic fatalities 582 new message beginning today traffic deaths 616 slow workers,1,140,22,1,0,0,0
5210,driver fatalities irish roads pedestrians cyclists risk,1,102,14,1,1,0,0
5211,ebrointheam jaybig lpunbiggiewrap overzero questionfatalityflawless victory,0,124,7,0,1,0,0
5212,jakeadavis fatalityus cuddling right,0,59,9,0,0,1,0
5213,trulystings yo dm,1,22,4,0,0,0,0
5218,savages leaked thomas brady gangstermail account wonder quick fatality samsung mobile b real son,0,129,22,0,0,1,0
5219,liked youtube video vgbootcamp sx 109 sn vabengal zss vs sws fatality captain falcon,0,130,21,0,1,0,0
5220,hibernating pbx irrespective pitch fatality careerism pan crbzfz,0,68,9,0,0,0,0
5221,fatality,0,9,1,0,0,0,0
5222,dying lyme disease case fatality rate nearly 100,1,76,10,0,1,0,0
5223,hripsk u fatality like corpse still jittering,1,68,13,0,0,0,0
5224,fatality,0,8,1,0,0,0,0
5226,wow fatality 101 big rig hit motorcyclist blood everywhere wow im sick,1,79,14,0,0,1,0
5227,tellyfckngo jaycootchi nah hit homie wit fatality sond wit babality cold cold fuck lmfaoooo,0,125,21,0,0,0,0
5228,kosciusko police investigating pedestrian fatality hit train thursday,1,97,11,0,1,0,0
5229,fatality,0,33,3,0,1,0,0
5230,bardissimo yes life 100 fatality rate,0,46,8,0,0,0,0
5231,many baskets charming fatality tonyakappes11 get mystery paranormal,0,108,14,0,1,1,1
5232,making bad boys 3 4 must see,0,47,12,0,0,0,0
5233,fatalityus need team need one,0,38,7,0,0,1,0
5234,afghan soldier kills us general americas highestranking fatality since vietnam,1,103,11,0,1,0,0
5235,usually never happens,0,26,4,0,0,0,0
5236,babybackreeve fatality,0,33,2,0,0,0,0
5238,08315 cat fatality utica ny pleasant amp holland aveblack cat white paws average size grass next north side road,0,138,24,0,0,0,0
5242,pxnatosil renunciedilma fatality,0,36,4,0,0,0,0
5243,jaxmk2 stage fatalityuudlk close,0,40,4,0,0,0,0
5244,seeing theres video every fatality mileena makes sad,0,72,13,0,0,0,0
5245,chrisman528 fatality,0,25,3,0,0,0,0
5247,kosciusko police investigating pedestrian fatality hit train thursday,0,97,11,0,1,0,0
5248,fatality,1,32,2,0,1,0,0
5249,fatality scary af probably best falcon still scary,0,64,11,0,0,0,0
5251,liked youtube video vgbootcamp sx 109 sn vabengal zss vs sws fatality captain falcon,0,130,21,0,1,0,0
5252,truck crash 40w us70 lebanon fatality sad expect long delays morning,1,102,19,0,0,0,0
5254,lindasocvat tflbusalerts yes apparently report cow fatality well sadly,1,80,11,0,0,0,0
5255,liked youtube video deathmule mk x tremors stalag might fatality ermac tournament pharaoh,0,126,18,0,1,0,0
5256,added video youtube playlist sx 109 sws fatality captain falcon vs snow fox ssb4 losers,0,130,22,0,1,0,0
5257,death loretta fuddy responsible authenticating obama birth certificate sole fatality nine plane,1,135,18,0,1,0,0
5259,fatality,0,13,2,0,0,1,0
5260,everyday near death fatality road thank god side,0,80,17,0,0,1,0
5262,fear factory december done deal,0,36,6,1,0,0,0
5263,made friend interesting yall combined,0,83,12,0,1,0,0
5264,meaning picked one changed life overcome fear behold wonder tcc catch light endless,0,137,19,1,1,0,0
5265,phnotf sometimes cheekiness bleeds computer screen recoil fear,0,88,14,1,0,0,0
5266,cause know every man fear strongminded woman say shes keeper got keeps runnin,0,128,29,1,0,0,0
5267,biggest fear disappointing people believe,0,61,11,1,0,0,0
5269,didnt want hurt fear drove midnight,0,81,16,1,0,0,0
5270,men fear feeling controlled woman passive aggressively coerced commitment theyre ready,0,132,20,1,0,0,0
5271,things fear organizationsfluctuations disturbances imbalancesare primary sources creativity margaret wheatley,0,138,17,1,0,0,0
5272,fear factory cars official musicvideo,0,64,7,1,1,0,0
5273,luzukokoti understanding umntu wakho trust partner ok u know wont fear anything,0,140,27,1,0,0,0
5274,photo referencereference xekstrin thought nostrils eyes almost cried fear partake,0,132,17,1,1,0,0
5276,baileysmsteach fear looking like know doingûahhhûthat big one perrychat,0,120,21,1,0,0,1
5278,opposite love fear hereûªs,1,64,8,1,1,0,0
5280,fear youtube,0,37,4,1,1,0,0
5281,help win shares article lifetime fear thanks blackinamerica growingupblack,0,140,21,1,1,0,1
5282,cowgirllawyer must refuse become nation everyone living fear shot unawares intoxicated ampor crazy people,1,138,22,1,0,0,0
5283,horror films made incredibly creative artists interviewed 21 depth anatomy fear,1,136,21,1,1,0,0
5284,want forever stay side special night fear loathing las vegassolitude xmas,0,114,19,1,0,0,0
5285,worst fear,0,38,4,1,1,0,0
5286,shakjn c7 magnums im shaking fear hes gon na hack planet,0,66,12,1,0,0,0
5287,world say finish god says dont fear choosegod restoringpaths,0,98,13,1,1,0,1
5290,replacing fear unknown curiosity open toû,0,99,14,1,1,0,0
5291,love god fear hell,0,32,7,1,0,0,0
5292,dont tell bride gives fear,0,38,8,1,0,0,0
5293,scottdpierce billharristv harrisgle beezersun im forfeiting years fantasy football pool fear may win n get ass kicked,0,140,22,1,0,0,0
5295,right im reopening xfiles thats fear thexfiles201days,0,97,15,1,0,0,1
5296,live balanced life balance fear allah hope mercy love,0,90,18,1,0,0,1
5297,biggest fear eventually see way see,0,72,15,1,0,0,0
5298,couples less sex fear itll let internet movies books saying sex ought pû,0,139,23,1,1,0,0
5299,nothing fear taking risks,1,45,8,1,0,0,0
5300,untangle requiring partner fill needs love without fear besttalkradio listen,0,138,19,1,1,0,1
5301,walking dead spin fear walking dead 23rd,1,69,14,1,0,1,0
5302,mcnabbychic fear,0,35,7,1,0,0,0
5304,fear lord start knowledge foolish use wisdom teaching amsal 17,0,111,22,1,0,0,0
5305,number people denying climate change polar bear article makes fear future us also humanity general,0,138,26,1,0,0,0
5306,sensanders gd ideas im 77 wrked hard almost nothing fear lives poor fran reed 8437150124,0,105,17,1,0,0,0
5308,never let fear get way achieving dreams deltachildren instaquote quoteoftheday disney waltdisney,0,140,17,1,1,0,1
5309,fear motivator,0,20,4,1,0,0,0
5310,daily reflections august 6 driven driven hundred forms fear selfdelusion selfseeking selfpity,0,134,14,1,1,0,0
5313,morganite gemstone white fire opal 925 sterling silver ring size 6 r1354,0,118,14,1,1,0,0
5315,marquei como visto game thrones 3x5 kissed fire bancodeseries,0,95,14,1,1,0,1
5316,save date saturday august 15 2015 salisbury fire department open house 325 cypress st 10am,0,134,21,1,1,0,0
5317,put fire still burning,0,43,9,1,0,0,0
5319,misshomasttopa cause fire fire fire yeah fire fire fire,1,124,25,1,0,0,0
5320,avi header combo fire,0,31,7,1,0,0,0
5321,auction shoes retro 5 fire red,0,78,8,1,1,0,1
5322,asshole fire,0,46,7,1,1,0,0
5323,im crying song ended setting fire,0,79,12,1,1,0,0
5324,setting things fire always option,1,42,8,1,0,0,0
5325,sitting around fire sounds great right,0,50,9,1,0,0,0
5326,see fire,0,10,3,1,0,0,0
5328,put flood fire top list,1,72,13,1,1,0,0
5330,im fire,0,36,5,1,1,0,0
5331,politifiact harry reids 30 percent women served planned parenthood claim pants fire lie tcot,0,135,20,1,1,0,1
5332,dear canonusaimaging brought canonbringit fire canontattoo mn theresmorewherethatcamefrom,0,127,13,1,1,0,1
5335,seanhannity scottwalker yeah need another middle class hating republican get hard working cops fire fighters teachers,0,138,21,1,0,0,0
5336,fire way close wtf going,1,70,12,1,1,1,0
5337,fire meet gasoline always got ta get played twice lol,0,52,9,1,0,0,0
5338,wcw catsandsyrup tha bitch fire,0,35,6,1,0,0,0
5339,well feels like im fire,0,30,7,1,0,0,0
5341,eyes words icy burns like rum fire,0,64,15,1,0,0,0
5342,news politifiact harry reids 30 percent women served planned parenthood claim pants fire lie,0,136,19,1,1,0,1
5343,nothing like good fire,1,48,6,1,1,0,0
5344,daughterofnai tenshi activated yukis fire card,0,49,6,1,0,0,0
5345,california shakingcatching fireand overcharging ppl rent past 150 years aint going nowhere,1,122,18,1,0,0,0
5346,theres fire catalinas looks kinda cool picture doesnt justice,1,110,16,1,1,0,0
5347,zaynmalik dont overwork album gon na fire dont overwork stress love take care,0,115,20,1,0,0,0
5349,justinling promise tax pancakes rainbows dying fire,0,78,15,1,0,0,0
5350,nigga cyhi diss meek suppose shit actually fire,0,77,15,1,0,0,0
5351,wan na set shit fire,1,30,7,1,0,0,0
5352,words charlie daniels fire mountain run boys runû,1,95,14,1,1,0,0
5353,checked ûò fire zomatoaus lovefood,1,80,12,1,1,0,1
5354,heart bigger obstacles front euro dontexpectnothing july fire euro,0,104,18,1,0,0,1
5355,fire waves darkness,0,23,4,1,0,0,0
5356,may seem like fire little burnt,0,57,12,1,0,0,0
5357,smelling bon fire driving makes wan na sitting near one making smores,1,88,16,1,0,1,0
5359,dropping fire selfie tomorrow saying youre welcome ahead time,0,76,12,1,0,0,0
5362,fire call brant av drummond rd fire structure single units car 6 call truck,1,115,20,0,1,0,0
5365,psa day fire truck behind lights going move get call,0,113,24,1,0,0,0
5366,rfp fire truck service body f450 fire fighting rescue amp safety equipment transporta,0,121,15,1,1,0,1
5367,reno truck trailer catches fire reno,1,63,8,0,1,0,1
5368,wild night village pugwash every fire truck town like fire truck every house population6,1,135,26,1,0,0,0
5371,18wheeler came along struck fire truck spinning around 180 degrees causing roll,1,134,21,1,1,0,0
5372,sigalert update 3n133 closed 5 fwy ufn trash truck fire,1,67,11,0,0,0,1
5373,brooktekle didnt look like murder scene 1 cops fire truck 2 fire assistance cars along helicopter,1,120,22,1,0,0,0
5375,former township fire truck used philippines langley times philippines,1,104,13,1,1,0,1
5377,former township fire truck used philippines township langley assistant fire chief pat walker spen,1,136,18,1,1,0,0
5378,garbage truck really caught fire lmfao,0,46,8,0,0,0,0
5379,kapokekito northgate taco truck thats fire,1,55,9,0,0,0,0
5380,never good sign pull work amp theres five ambulances amp fire truck bay wompppp least friday,1,137,27,1,0,0,0
5381,fire truck ambulance k3 phase 3 hope everyones okay prayforsaipan,1,76,12,1,0,0,1
5382,sigalert north amp southbound 133 closed btwn 5 fwy irvine blvd due truck fire chp detouring traffic,1,116,20,0,0,0,1
5383,eeenice221 true truck caught fire,1,55,9,0,0,1,0
5384,justinejayyy ohgod xd didnt mean p fire truck back make good xd,0,126,29,1,0,0,0
5385,came across fire video mineenjoybabes way saying hi hes fire truck fireman û,0,141,21,1,1,1,1
5386,133 n past 5 l lane reopened lanes closed lanes open 133 trash truck fire cleanup knx1070,1,133,28,0,0,0,0
5387,sigalert north amp southbound 133 closed btwn 5 fwy irvine blvd due truck fire chp detouring traffic,1,116,20,0,0,0,1
5389,found cool photo mine 1952 dodge wayne bodied 4 window bus ex libby mt fire department truck oriû,1,138,23,0,1,0,0
5391,trident 90225 chevy fire truck w pumper ims fire dept red ho 187 plastic,0,123,18,1,1,0,0
5392,toddler bedding firetruck bundle fire truck firefighter sticker decals sign wall,0,103,12,1,1,0,0
5396,monster truck racer catches fire fair,1,54,11,0,0,0,0
5397,truck fire clogs canyon road,1,51,6,0,1,0,0
5400,rgj truck trailer catches fire reno,1,62,8,0,1,0,0
5403,philippines former township fire truck used philippines û emergency equipment cebu philippi,1,138,19,1,1,0,1
5404,theres fire truck parking lot,0,39,8,1,0,0,0
5406,evening sun article nno,0,50,6,0,1,0,0
5407,choose happy fire truck rest review kick push jaymcleanauthor,0,111,16,1,1,1,0
5408,former township fire truck used philippines langley times filipino,0,101,13,1,1,0,1
5409,jacksonville fire amp rescue engine 58 awesome truck official jade fl via youtube,1,116,16,0,1,0,0
5410,njturnpike å njturnpike reopens hours truck fire,1,107,11,0,1,1,1
5411,lukebox something first responders military true heros besides music,0,97,14,1,0,0,1
5412,im grateful first responders mnpdnashville nashvillefd others acted swiftly save countless lives today,1,132,21,1,0,0,0
5413,usatoday praying gods healing safety first responders,0,68,11,1,0,0,0
5416,join charity 10k run event doningtondash 11am start sun 20 sept 2015 castle donington community first responders,0,140,15,1,1,0,1
5417,loved way book written include many vantage points first responders detkenlang kindle,0,132,19,1,1,0,1
5418,first responders would never sent wrong address w smartteks gpsbased panic button mpers safety,0,139,19,1,1,0,1
5420,û÷we helpûª says denver firefighter working curb first responder suicide,1,104,13,0,1,0,0
5423,whats cool teens becoming like call digital first responders friends need little help support,0,140,26,1,0,0,0
5425,carmike cinemas antioch shooting grateful staff first responders safety highest priority,1,137,18,1,1,0,0
5426,rt roadid thanks alex story amp first responders need û,0,130,22,1,1,0,0
5428,added sandy first responders lost homes vip home page group vimeo,1,112,17,1,1,0,0
5430,thankful first responders especially mnpdnashville life saving response today antioch,1,102,14,1,0,0,0
5432,juneau empire first responders turn national night,0,87,12,1,1,0,0
