id,text_clean,target,len_text,count_word_uniques,text_contain_keyword_norm,contain_link_norm,contain_question_norm,contain_hashtag_norm
2560,sterlingknight car crashsterlingwho driving carmel joeysterling knight,0,104,15,1,0,1,0
2561,daewony0406 alright im gon na crash im exhausted,0,57,9,1,0,0,0
2564,party bestival crash victim michael molloy would 21st,1,102,15,1,1,0,0
2565,cleared crash hamilton i75 south mm 459,1,51,10,1,0,0,0
2566,deliver value cash source crash course course,1,95,10,1,1,0,1
2568,next financial crash writing wall dont say werent warned,0,109,16,1,1,0,0
2569,boy crash,0,45,5,1,1,0,0
2570,make man pikin crash,1,27,5,1,0,1,0
2571,incident crash pascoe vale south outbound tullamarine fwy citylink near moreland rd vehicles emergency lane delays,1,136,20,1,0,0,1
2572,let another love crash burn,0,33,7,1,0,0,0
2573,sit rant snapchat apparent fans 8000 followers hope train crash xoxo,0,122,25,1,0,0,0
2575,crash burn,1,41,5,1,1,1,0
2576,cpanel crash course course,0,73,6,1,1,0,1
2579,destinythegame bungie playstation getting kicked crash one worst experiences ive playing video games,0,131,20,1,0,0,0
2582,chelsdelong12 kendraleigh13 ill crash,1,45,5,1,0,0,0
2585,please keep josh salyersblairhall families amp jennas friends prayers taken far soon rip,0,142,20,0,1,0,0
2587,one night gon na come crash party werent invited feelin soû,0,116,16,1,1,1,0
2588,fatal crash reported johns island,1,61,7,1,1,0,0
2590,photoshop tools crash course complete photoshop tool guide course,0,114,12,1,1,0,1
2591,photoshop cs6 crash course course,0,80,7,1,1,0,1
2592,kinetic typography crash course effects video course,0,109,10,1,1,0,1
2593,police respond crash find suspected heroin,1,70,8,1,1,0,0
2594,see dat liable fuck crash,0,45,11,1,0,1,0
2597,akilah world news cop pulls man car avoid,1,81,13,0,1,0,0
2598,man killed crash barrington hills hoffman estates man killed singlecar crash wednesday afte,1,136,20,1,1,0,0
2599,crash helmet silvery floors karnal fat shoot sampling 33 pbcanpcx,0,66,10,1,0,0,0
2602,crash test trailer paul scheer amp rob huebels comedy special recorded,0,108,15,1,1,0,0
2603,spicybreads coxytown tried downloading crashed tutorial,0,79,12,1,0,0,0
2604,maj muzzamil pilot offr mi17 crashed near mansehra today,1,84,11,1,1,0,0
2605,bin laden family plane crashed avoiding microlight landi peritoengrafoscopia,1,137,13,1,1,0,1
2606,son didnt sleep night finally 4am laid bed crashed,0,104,24,1,0,1,0
2608,neileastwood77 knobhead bin laden family plane crashed avoiding microlight landing û,1,136,18,1,1,0,0
2609,bin laden family plane crashed avoiding microlight landing far runway three members,1,136,19,1,1,0,0
2611,brianroemmele ux fail emv people want insert remove quickly like gas pump stripe reader 1 person told crashed pos,1,139,27,1,0,0,0
2612,major hamayun shaheed pilot mi7 heli crashed mansehra,1,88,12,1,1,0,0
2614,uk bin laden family plane crashed avoiding microlight landing far runway three members,1,136,19,1,1,0,1
2616,rosewell crashed many times past couple hours,0,61,11,1,0,0,0
2617,gt bin laden family plane crashed avoiding microlight landing far runway rochdale heywood,1,139,18,1,1,0,1
2619,ipod crashed weloveyoulouis mtvhottest one direction,1,64,7,1,0,0,1
2621,johndcgow heard days ago driving near crashed car laughing much,0,95,17,1,0,0,0
2622,olliebailey11 havnt crashed,0,37,6,1,0,1,0
2624,could anyone tell crashed taking long time windows10 please,0,119,19,1,1,0,1
2625,intactmh370partliftsoddsplaneglidednotcrashedintosea via yahoofinancehope answers,1,121,6,1,1,0,1
2627,pak army helicopter crashed mansehra,1,40,6,1,0,0,0
2628,1 ûò bug almost crashed euro,1,67,11,1,1,0,0
2629,pakistan says army helicopter crashed countrys restive northwest killing least 8,1,114,15,1,1,0,0
2631,news bin laden family plane crashed avoiding microlight landing far runway,1,119,16,1,1,0,1
2632,guy bought car tuesday police knocked door yday cos crashed n ran amp 2day text asking send log book,1,144,29,1,0,1,0
2633,maj muzzamil pilot offr mi17 crashed near mansehra today may almighty give strength family bear loss,1,138,21,1,1,0,0
2635,thief broke front window hicksville store stole 50 cell phones fled crashed,0,110,15,1,1,0,0
2637,army sources say 12 persons board including team doctors die helicopter crashed near mansehra weather seems cause crash,1,140,25,1,0,0,0
2640,smusx16475 skype crashed u host,0,37,6,1,0,0,0
2641,already phone updated 84 somehow phone crashed restore theyre letting restore,0,128,26,1,0,0,0
2642,4 second faster overtook twice crashed tru luv lt3 lt3,0,101,21,1,0,0,0
2643,nearly crashed car typing paul rudd attacked flying ants notes phone,0,95,18,1,0,0,0
2644,honestly nightmarish god driving new places always stressful shit amp hate much ugh almost crashed times,0,132,24,1,0,0,0
2645,crashed car parked car day modestmouseremix truestory,0,80,13,1,0,0,1
2647,f496d mhtw4fnet pakistan says army helicopter crashed countrys restive northwest fox news,1,101,15,1,0,0,0
2648,ttw todays news bin laden family plane crashed avoiding microlight landing far runway,1,132,19,1,1,0,0
2649,heard skh radio first time almost crashed car 5sos ashton5sos luke5sos michael5sos calum5sos,1,119,18,1,0,0,1
2651,mh370 intact part lifts odds plane glided crashed sea,1,86,12,1,1,0,0
2655,kuualohax like love husband youre posting another man man crush mondays lol,0,105,18,0,0,0,0
2656,womem crush wednesday mommyisbomb,0,53,5,0,0,1,0
2657,jorrynja 6 bfgfcrush terell,1,49,8,0,0,1,0
2658,guy idk made woman crush first one ever,0,62,14,0,0,1,0
2659,wce cant even lie even tho cant stand still always crush explicitpretty,0,101,20,0,0,1,0
2660,women crush,0,39,4,0,1,1,0
2661,woman crush wedneday goes beautiful taykreidler loveyouuuu aintsheperty,0,108,12,0,1,0,1
2663,bestfriends high school crush yourboyshawn,0,64,8,0,0,1,0
2664,ina buted girl crush,1,22,4,0,0,1,0
2666,samelsamel crush,0,47,5,0,1,0,0
2667,im woman crush,0,27,6,0,0,1,0
2668,love love love remember first crush,0,52,11,0,0,1,0
2670,minute alone crushit overrated experiencesmh,0,73,11,0,0,1,0
2671,pydisney que crushmtvhottest justin bieber,0,45,5,0,0,1,1
2672,master0fsloths crush,0,50,5,0,1,0,0
2673,lil brother crush mariah,0,43,9,0,0,1,0
2675,ron amp fez daves high school crush via youtube,1,77,11,0,1,0,0
2676,youre girlfriend completely gorgeous woman crush amp stuff,0,99,12,0,1,1,0
2677,im high moe im bouta crush fridays,0,45,9,0,0,0,0
2679,biggest crush amp dont know youll ever know,0,75,17,0,0,1,0
2680,mrrobinson giving thesteveharveyshow vibe music teacher looks students crush girl went high school,0,137,23,0,0,1,1
2682,seriously biggest girl crush ever blake lively,0,58,10,0,0,0,0
2683,see crush stands vine khadidon,0,82,12,0,1,0,0
2684,yhngsjlg tweeted secret crush,0,69,7,0,1,0,0
2687,starflamegirl yeah crush,0,42,8,0,0,0,0
2688,trying look cute wen crush passing,0,73,12,0,1,0,0
2689,crush content marketingåêmediocrity,0,81,5,0,1,0,0
2691,crush one girl high school dont even realize lol,0,77,17,0,0,0,0
2692,sevenfigz crush,1,45,5,0,1,0,0
2693,men crush every fucking day,0,78,6,0,1,1,0
2694,tiffanyfrizzell crush,0,51,5,0,1,0,0
2695,crush wce nykaed,0,77,9,0,1,1,0
2696,jaureguiswisdom lmao well know one ive crush one sooo,0,84,17,0,0,0,0
2698,nowplaying fitz tantrums league crush listen nowplaying,0,105,15,0,1,0,1
2700,man crush everyday cristianinspire,0,64,7,0,1,1,0
2701,love love aint playa crush lot,0,66,18,0,0,0,0
2702,kenny holland crush da vida,0,27,5,0,0,0,0
2703,crushed,0,7,1,1,0,0,0
2706,popeyes bout get crushed,0,35,7,1,0,1,0
2707,crushed holy shit,0,26,5,1,0,0,0
2708,bhavanas mom crushed everyones soul,0,41,6,1,0,0,0
2709,crushed,0,35,3,1,1,0,0
2711,wrapup 2us cable tv companies shares crushed disney disappoints,0,119,12,1,1,0,0
2714,jimmyfallon crushed squirrel bones mortar pestle schools bio dept really sure worstsummerjob,0,125,20,1,0,0,1
2715,edwin wow crushed,0,19,3,1,0,0,0
2719,mango juice crushed icegtgtgtgt,0,46,5,1,0,1,0
2720,man crushed death car,1,54,8,1,1,0,0
2723,diamond piece charcoal handled stress exceptionally well hard pressed every side crushed2 cor48,1,136,24,1,0,0,0
2724,wow crushed edwing bluejays,0,39,6,1,0,0,1
2725,crushed gym crushed butterfinger flurry clearly priorities straight,0,88,14,1,0,1,0
2726,wrapup 2us cable tv companies shares crushed disney disappoints,0,96,11,1,1,0,0
2727,jmastrodonato question would crush ortiz bunting sports writing forefathers crushed williams,0,121,18,1,0,1,0
2728,cbsbigbrother ouch clelliyou could almost hear hopes dreams crushed,0,90,13,1,0,0,0
2729,jesus christ ball fucking crushed bluejays,0,54,8,1,0,0,1
2730,crushed 31 km run pace 541 nike sportwatch gps nikeplus,0,104,17,1,1,0,1
2731,papi absolutely crushed ball,0,33,5,1,0,0,0
2732,crushed 6 mile run tonight awesome,0,37,7,1,0,0,0
2733,wrapup 2us cable tv companies shares crushed disney disappoints,0,96,11,1,1,0,0
2734,oil prices falling drivers could reap benefits,0,73,9,0,1,0,0
2736,crushed 112 km run pace 746 nike sportwatch gps nikeplus,0,105,17,1,1,0,1
2739,nick williams hit another bomb crushed,0,52,9,1,0,0,0
2740,holy moly crushed,1,27,5,1,0,0,0
2741,ayekoradio play brasswork agency crushed shaken radio netlabel electronicmusic listen ccmusic,0,128,14,1,1,0,1
2743,many youtube commenters saying dothraki would get crushed came westerosnah bro underestimate dothraki,1,130,20,1,0,0,0
2744,disillusioned lead character check happy go lucky free spirit girl check dream life crushed check great music check crowe tropes intact,0,140,15,1,0,0,0
2748,remember nora jones crushed two weeks notice,0,55,10,1,0,1,0
2749,empire avenue crushed soul via markwschaefer,0,75,9,1,1,0,0
2752,13 chapoutier crozes hermitage much purple violets slate crushed gravel white pepper yum france wine dc,0,137,19,1,1,0,1
2753,thecomedyquote 50shadezofgrey thirst curfew p45perez,0,79,9,1,0,1,0
2755,ara news reporting jan fighters infiltrated ashrafiyah district afrin aim carrying suicide attacks ypg imposed curfew,1,140,22,1,0,0,0
2756,keampurley thirst curfew,0,32,5,1,0,0,0
2757,fact curfew,0,33,8,1,0,0,0
2758,michelleellle shut freshman past ur curfew u need sleep u spend much ur time watching tv instead going outside,0,142,27,1,0,1,0
2759,night curfew campus find,0,97,11,1,1,1,0
2760,police teenagers arrested curfew violations evanston riding stolen bicycles two teenagers taken cus chicago news,1,137,20,1,0,0,1
2761,reason im listening curfew overtime stuck kodak,0,88,17,1,0,0,0
2763,bobbyxfisher shouldve gave curfew,0,43,7,1,0,0,0
2765,curfew really helps think bc,0,49,10,1,0,0,1
2766,exofficio mens boxer brief curfew large,0,63,7,1,1,0,0
2767,info wnd 0306 cld sct014 bkn032 exp inst apch rwy 05 curfew oper 2030 z taxiways foxtrot 5 amp foxtrot 6 navbl tmp 10,0,142,27,1,0,0,0
2768,emaaalay thank dont city wide curfew,0,65,13,1,0,1,0
2769,said curfew nope,0,44,9,1,0,1,0
2770,curfew start right private class ends tutor must woman preferably someone 50,0,104,18,1,0,0,0
2771,aptlyengineerd curfew,0,41,6,1,0,0,0
2773,past curfew grove,0,43,9,1,0,0,0
2774,emmychappy 12 oclock mom said everyone go home curfew,1,94,17,1,0,0,0
2777,reddakushgodd said months get curfew time smfh,0,74,15,1,0,0,0
2778,ball curfew,0,42,5,1,1,0,0
2780,scotrail seen turn blind eye bloke drinking smoking curfew time cosits worth hassle,1,129,25,1,0,0,0
2782,next may ill freefrom school obligations like family best damn curfew,1,100,16,1,0,0,0
2783,daviskawalya know mauryn143 saying final goodbyes grandpa seen news rip always open ideas may curfew,0,139,26,1,0,1,0
2784,people really still curfew even theyre 18 amp graduated high school,0,88,15,1,0,1,0
2785,stupidniggr im telling mom past curfew oth,0,58,10,1,0,0,0
2786,cancel cats doctor appointment decided go play come home curfew,0,111,22,1,0,0,0
2787,info r curfew oper 2030 z taxiways foxtrot 5 amp foxtrot 6 navbl wnd 0605 exp inst apch rwy 05 damp tmp 10 qnh 1028,0,139,27,1,0,0,0
2788,lies though pays oldest sometimes like first get car curfew freedom donthate,0,130,25,1,0,0,1
2792,info u cld sct012 bkn025 exp inst apch rwy 05 curfew oper 2030 z taxiways foxtrot 5 amp foxtrot 6 navbl tmp 10 wnd 0306,0,142,27,1,0,0,0
2793,rite man tlk widout nuh curfew long side aka cum fi steal di show itz rubbery di whole dem fi knw sound music,0,127,28,1,0,0,0
2794,dont even come worried curfew bc19,0,48,9,1,0,0,1
2795,got whole curfew,0,27,6,1,0,1,0
2796,youre 5 hours late curfew pray dog doesnt bark unlocking door,0,98,19,1,0,0,0
2797,da judge gave dis girl 5pm curfew,0,40,8,1,0,1,0
2799,beginning summer mom made curfew 1 back 12 never go wonders im always home,0,132,30,1,0,0,0
2801,charlie lim start 9pm sunday curfew leh,0,70,14,1,0,0,0
2802,u bombed u try 2 get home curfew,0,68,12,1,1,0,0
2803,baby walter rewatchingthepilot teamscorpion cyclone,0,60,6,1,0,0,1
2807,big ten annual football media day get heres cyclone hoops recruiting nuggets,1,122,21,1,0,0,0
2808,camera art photography 0215 new boltåêcyclone dr pp400dr dual outlet power packåêfor external camera flash 30û,0,142,16,1,1,0,1
2811,mccauleysdesign abysmaljoiner dyamiplotke works purpose large cyclone would better dont 4k 500,0,139,22,1,0,0,0
2813,new tropical cyclone forming near guam formed called molave,1,91,16,1,0,0,0
2815,video new de jhaustin thomas cyclone ames tribune ames tribune video new de jhaustin thomas onû,0,136,21,1,1,0,0
2817,xhnews need plants pacific cyclone seasons would help,1,84,15,1,0,0,0
2819,bbc forced retract false claims cyclone pam via wordpressdotcom,1,96,12,1,1,0,0
2820,great condition easton cyclone softball bat fastpitch 9 2920 sk398,1,116,12,1,1,0,0
2821,severe weather bulletin 5 typhoon ûïhannaphû soudelor tropical cyclone warning issued 500 pm 06,1,142,15,1,1,0,1
2822,cyclone derives powers calm center person norman vincent peale,1,93,17,1,0,0,0
2825,roughdeal1 ante hudhud cyclone chandrababu valle ne ante ga,1,61,9,1,0,1,0
2826,cyclone komen devastates families myanmar week need help today,1,106,15,1,1,0,0
2827,severe weather bulletin 6 tropical cyclone warning typhoon hanna issued 1100 pm thursday 06 august,1,135,16,1,1,0,1
2828,back future vanuatu cyclone pam encouraged traditional ways living,1,135,16,1,1,0,1
2829,bank manager asks tom interview cyclone tom loan given purchase bicycle,0,106,19,1,0,0,0
2830,excited cyclone football,0,52,5,1,1,0,0
2831,bbc forced retract false claims cyclone pam via wordpressdotcom,1,96,12,1,1,0,0
2832,talent misdirection cyclone pass ignite pass vanishing drive phantom shot kurokobot,1,86,12,1,0,0,1
2833,comdev asia radio stations bangladesh broadcasting programs address upcoming cyclone komen,1,137,17,1,1,1,1
2835,like cyclone imperialism spins across globe militarism crushes peoples sucks blood like,1,132,18,1,1,0,0
2836,1970 mercury cyclone gt hood moulding nice core cobra jet 429cj gt,0,117,15,1,1,0,0
2838,im cyclone passion overblown,0,57,6,1,1,0,0
2839,majesty emperor salman khans unstoppable cyclone entertainment humanity bajrangi bhaijaan creating history everywhere crosed 300 cr,0,140,17,1,0,0,0
2841,1970 mercury cyclone gt quarter panel ds rear trim moulding cobra jet 429cj,1,122,15,1,1,0,0
2842,tropical cyclone info soudelor 945hpa maximum wind speed 45ms maximum wind gust speed 60ms,1,120,16,1,1,0,0
2843,cyclonereizei may ask cyclonesama read jailed fate rindou,0,78,13,1,0,1,0
2844,drugs alcohol jackson vroman house,0,71,8,0,1,0,0
2846,blending old new vanuatu prepare future emergencies,0,123,15,0,1,0,1
2849,wfp wfp delivers food 165000 bangladesh flood victims tropical cyclone komen dhaka ûòthe united na,1,137,19,1,1,0,0
2851,rohingya houses kyee nockthie hamlet taungbazar region buthidaung severely damaged cyclone kasitaroch vivianunhcr,1,136,18,1,0,0,1
2852,cyclone double g would cherry top outfit ootd doubleghats,0,127,17,1,1,0,1
2853,thelegendblue cozmo23 theyll probably allow us ascend get damage max values,0,106,18,1,0,0,0
2854,drop nigga damage,0,38,10,1,0,1,0
2855,unions say supportive london yet prepared damage economically å£300m last time,0,129,18,1,1,1,0
2856,liked youtube video gta 5 online collateral damage gta v online pc,0,99,16,1,1,0,0
2857,fyi accident property damage3460 limestone lncolyellowstone wayfieldstone dr08052015 193635,1,102,9,1,0,0,0
2858,fitness knee damage solution,0,52,5,1,1,0,1
2860,complaining phoenix mode fire emblem turns ray gigant difficulty option take 0 damage,0,139,25,1,0,0,0
2861,capicapricapri brentobento wha kids damage,0,55,8,1,0,0,0
2863,cleared accident property damage ny35 eb ny 100,1,61,12,1,0,0,1
2864,crazy phone much damage person,0,56,13,1,0,0,0
2865,writebothfists got pretty windy damage,0,62,10,1,0,0,0
2866,reusing advanced life equipments transit drumming champaign damage fdbdp,0,82,12,1,0,0,0
2867,indigo6e carful spotting damage time check time giving away baggage loss wy,0,140,28,1,0,1,0
2869,storm damage reported west tennessee,1,62,7,1,1,0,0
2870,hey royals love damage 2 outs,1,46,9,1,0,0,1
2871,drothvader cmnevalistis keep please arachys 2 pieces deals 4000 weapon damage 2500,1,127,22,1,0,0,0
2872,mages fairy tail specialize property damage natsu dragneel,0,71,11,1,0,0,0
2873,bradleybrad47 yeah fast extremely high damage want fast im gon na get u,1,138,27,1,0,0,0
2875,bradleybrad47 saw fast af great damage upgraded shitton used exclusively whole playthrough,0,127,23,1,0,0,0
2877,lets say tree falls fence know homeowners insurance may help,0,135,19,0,1,1,0
2878,joedawg42 tor tor situation wind damage enhanced wording key imo,1,80,14,1,0,0,0
2879,hfxstanfield beelievedc discoverycntr happening hear runway lighting damage contractor,1,115,16,1,0,0,0
2880,swb1192 nda written damage ability offer services future prolly dont want work anyway,0,133,25,1,0,0,0
2881,trillion crosses line 3rd time fieldwide attack instant kill damage,1,97,18,1,0,0,0
2882,np metallica damage inc,0,26,5,1,0,0,1
2883,nine inmates charged causing damage calgary remand centre riot,1,95,13,1,1,0,0
2884,pt crosssectarian protest powerful shia cleric says militias must withdrawur fightin isis wont forget damage uve done ur ppl,1,140,22,1,0,0,1
2885,homeowners insurance cover water damage good things know,1,126,15,1,1,1,0
2886,beach damage shit,1,27,6,1,0,0,0
2887,wonderousallure crosses arms cover hands anymore damage hhello,0,91,13,1,0,0,0
2888,new post blog thesensualeye model cam damage toronto apr 2014 nsfw pussy ass boobs asian nude û,0,140,17,1,1,0,1
2889,reported hit amp runin roadwayproperty damage 15901 statesville rd,1,74,10,1,0,0,0
2890,devil may cry 4 special edition vergil vs agnus window mission 6 dmd damage leedstraif,0,122,19,1,1,0,0
2891,glaucoma occurs fluid builds pressure inside eye level may damage optic nerve eyefacts,1,107,18,1,0,0,1
2893,jsunnews storm damage reported madison county thunderstorm damage reports ar via,1,136,14,1,1,0,1
2895,s61231a puncture wound without foreign body left index finger without damage nail initial encounter icd10,1,113,17,1,0,0,1
2896,thank richarkkirkarch ausinstarchitect words warning queenswharf brisbane via financialreview,0,135,14,0,1,0,1
2898,real shit damage bitch,0,34,7,1,0,0,0
2899,lmao fuckboy changed damage control pseudojuuzo,0,58,8,1,0,0,0
2900,michaelwestbiz standard damage control,1,39,4,1,0,0,0
2902,gettinglost jennellensbb munclejim said superficial wounds pepper spray damage,1,128,20,1,0,0,0
2905,blizzheroes dustinbrowder dad wont chase constantly amp time frequently great deal danger distraction lt3,0,146,23,1,0,0,0
2907,believe shirt company every animal ever danger better start seeing changes wildlife,0,133,25,1,0,0,0
2908,danger union bears,0,44,5,1,1,0,0
2909,signup open falling danger release day blast review tour signup,1,121,18,1,1,0,0
2910,dyannbridges yeshayad check rockin preview claytonbryant danger zone coming soon artistsunited,0,136,15,1,1,0,1
2911,red flag warning fire danger amp dry thunderstorms bay area weather cawx nwsbayarea,1,121,17,1,1,0,1
2912,carsonrex spaceangelseven check rockin preview claytonbryant danger zone coming soon artistsunited,0,140,15,1,1,0,1
2913,like could danger something,1,52,11,1,0,1,0
2915,last tree cut last fish eaten last stream poisoned realize,0,131,22,0,1,0,0
2916,take away preservation parks r imposition amp danger african people never imagined,0,125,19,1,1,0,0
2917,indian govt amp media take serious concern safety danger,1,120,17,1,1,0,0
2920,training grains wheat bare gold august heat anger im trespass lest seek danger,0,113,22,1,0,0,0
2921,therealrittz fettilootch slanglucci oppressions greatest danger coming soon album,0,116,12,1,1,0,1
2922,morehouse64 appears govt lost ethical moral relevance means whole usa population danger,0,139,24,1,0,0,1
2924,dont like head first slides especially home danger,0,67,11,1,0,0,1
2925,permits bear hunting danger outnumbering actual bears licenses floridas fir st petersburg,0,136,18,1,1,0,1
2927,riverroaming much danger please,0,47,7,1,0,0,0
2929,bluebirddenver fettilootch slanglucci oppressions greatest danger coming soon album,1,118,12,1,1,0,1
2931,uber looking repair recent bad rap nonprofit partnerships,0,104,14,0,1,0,1
2932,wish could get victorias secret front im good,0,63,13,0,0,0,0
2933,turnedonfetaboo hsjb215 check rockin preview claytonbryant danger zone coming soon artistsunited,0,138,15,1,1,0,1
2934,thetxi gunnersfan89 would arsenal fans want west ham relegation battle season danger afc sun,0,134,24,1,0,1,1
2935,remainontop fettilootch slanglucci oppressions greatest danger coming soon album,0,115,12,1,1,0,1
2936,nuggets fettilootch slanglucci oppressions greatest danger coming soon album,0,111,12,1,1,0,1
2937,danger excitement underwater cave diving,0,97,10,1,1,0,0
2939,girl wan na save like danger health try somebody wan na somebody else,0,109,22,1,0,0,0
2941,guns protection shit really shouldnt used unless life danger,0,88,15,1,0,0,0
2942,thirsty yall danger dehydration,1,40,7,1,0,0,0
2943,thunderstorms little rain expected central california high fire danger weather cawx,1,118,14,1,1,0,1
2944,wan na get danger days tattoo bad cool would spider look like someones wrist smth,0,102,21,1,0,0,0
2945,experience youre always angry critical pundit grave danger going rails 1,0,115,23,1,0,0,0
2946,danger skyler danger,0,43,10,1,0,0,0
2947,dangerous ok rest us danger,0,95,17,1,1,0,0
2948,investigate robert mueller didnt respond complaints since nov 2011 amp left meson danger,0,141,21,1,1,0,0
2950,honestly tho modibo maiga stealing living fuck im past best still danger fucktard coyi,1,137,28,1,0,0,1
2952,fear way making us see danger none contemplating logic behind situation find courage engage,0,138,26,1,0,0,0
2953,joel 228 book acts 217,0,56,8,0,1,1,0
2954,17 dead afghanistan aircraft crashes afghan military helicopter crashed remote region,1,137,21,0,1,0,0
2955,silent0siris even awesome norse landscapes loads atmosphere life boringdead snotgreen wastelands,0,131,19,0,0,0,0
2956,miss longer hairbut dead anyways wasnt even hair,0,69,14,0,0,0,0
2957,cjbanning 4sake argsuppose preborn attained individl rightsgenerally courtof law forbids killing unless dead person something,0,139,18,0,0,0,0
2959,remember time goku gave life dead birb hell goku,0,68,14,0,0,0,0
2960,naaa bee dead like legit zombie feel every sore part body,0,101,19,0,1,1,0
2963,happened get road right behind buses im dead serious,0,80,16,0,0,0,0
2965,lmfao fucking luis hhahaha im dead,0,34,6,0,0,0,0
2969,watched emmerdale nd dont know slightly attractive man named ross got beat nd hes dead,1,136,28,0,0,0,0
2970,soapscoop need confirm ross dead cause dont trust anyone else yh,0,84,17,0,0,0,0
2971,gailsimone iwasdisappointedby telltales walking dead good characters ampstory real gameplay many performance issues,0,141,18,0,0,0,1
2973,beforeitsnews hundreds feared dead libyan migrant boat capsizes rescue û,1,136,15,0,1,0,0
2974,itûªs war came see never see waved white flag front canûªt end dead wont misled,0,122,27,0,0,0,0
2975,jones94kyle oh fuck sake dead,0,41,8,0,0,1,0
2976,emmerdale ross really dead askcharley,0,44,6,0,0,1,1
2980,avoid wearing dead black flaming red stark white much esp debate go blue gold brown even shoes,0,132,26,0,0,0,0
2982,perspectives grateful dead critical writings contributions study,1,126,13,0,1,0,0
2983,hlportal hello im looking mod cold ice saw site link download dead maybe share thanks,0,140,28,0,0,1,0
2984,kg4vaal lmaovv hard ny new trend babalmaowelcome nyozi kwaaaaadead,0,92,14,0,0,0,1
2987,jones94kyle ive said hes dead one else dies,0,66,13,0,0,0,0
2988,ross dead noooooooooooo mikeparractor,0,41,5,0,0,0,0
2990,thinking time friend bailed nite b4 dead showwent alone amp great time alone free dance front row,0,142,28,0,0,0,0
2991,typhoon soudelor taking dead aim taiwan,1,65,8,0,1,0,0
2992,askcharley emmerdale emotional ross dead emmerdale 5,0,76,12,0,0,1,1
2993,man found dead demi moores swimming pool,1,68,9,0,1,0,0
2995,thats val dead im suing,1,30,7,0,0,0,0
2998,atchisonsean dead,0,24,4,0,0,0,0
3000,wyrmwood road dead 2014 fucking awesome awesome ending awesome one,0,100,18,0,0,0,0
3001,cant believe ross dead emmerdale mikeparractor emmerdale summerfate,0,83,9,0,0,1,1
3003,call text 2 niggas bff amp boyfriend love boys death niggas hold attention like,0,140,30,1,0,1,0
3004,hate talking otp grandma mean love death talk damn much ssshhheeesshh,0,120,24,1,0,1,0
3005,death ill forever rep jets,1,41,8,1,0,0,0
3006,vibrator shaped vape done busted,0,35,6,0,0,0,0
3009,death threats nigga life well gon see,0,50,11,1,0,0,0
3010,adult dies plague colorado,1,55,7,0,1,0,0
3011,xbox 360 pro console red ring death full read ebay,0,108,16,1,1,0,0
3012,going back gainesville death,1,49,10,1,0,0,0
3013,year later ferguson sees change asks itûªs real,0,80,12,0,1,0,0
3014,papiichampoo enjoy obama era civility prez says gop supports iranian death,0,136,21,1,1,0,1
3015,feel like death,0,17,4,1,0,0,0
3016,liked youtube video jeromekem dj hazard death sport,0,87,13,1,1,0,0
3018,tell cousins dont wan na hang text saying coming honestly death wish,0,118,24,1,0,0,0
