id,text_clean,target,len_text,count_word_uniques,text_contain_keyword_norm,contain_link_norm,contain_question_norm,contain_hashtag_norm
7907,else wants documents radiation emergency procedures 06 24 09 radiation emergency procedures 06 24 09,0,133,17,1,1,0,1
7908,ccot tcot radiation nuclear emergency tracking center,0,103,7,0,1,0,1
7909,due rainstorm last night cupcake decorating happening rec hall 2 proceeds iwk,0,130,21,1,1,0,1
7910,rainstorm downtown gloucester gloucester capeann seagulls triciaoneill triciaoneillphoto,1,117,8,1,1,0,1
7912,myrtlegroggins ltgaspgt forgot sunday omg,0,50,6,0,0,0,0
7913,wow beauty lies within every storm taken today rainstorm aampb pipeliners,1,115,16,1,1,0,0
7914,rainstorm destroys 600 houses yobe state rainstorm destroys 600 houses yobe state daily trust damatu,1,137,19,1,1,0,0
7915,going beach jim alves means guaranteed rainstorm lucky,0,94,14,1,1,0,1
7916,dnb newrelease edge jimmy summer rainstorm lapaka sounds via,0,112,12,1,1,0,1
7918,three people killed severe rainstorm italian alps caused landslide,1,118,16,1,1,0,1
7923,landslide italian alps kills three rome reuters three people killed severe rainstorm th,1,136,20,1,1,0,0
7924,rainstorm destroys 600 houses yobe ireporter via sharethis,1,88,11,1,1,0,0
7926,stuck rainstorm stay toward middle road streets crowned water tends pool sides,0,119,23,1,0,1,0
7929,major rainstorm happening im gon na lie drift away storming around little bebacksoon,1,118,20,1,0,0,0
7930,landslide italian alps kills three rome reuters three people killed severe rainstorm,1,140,22,1,1,0,0
7932,cant roar waves rainstorm amp rollingû,0,97,15,1,1,0,0
7933,robotrainstorm two vacancies castle fantasy football team join us itûªs fun,0,100,16,1,0,1,1
7934,calum5sos look like got caught rainstorm amazing disgusting time,0,102,19,1,0,0,0
7935,rainstorm update north south,1,95,9,1,1,1,0
7936,nigeria rainstorm destroys 600 houses yobe state daily trust damaturu 600û,1,112,14,1,1,0,0
7937,landslide italian alps kills three rome reuters three people killed severe rainstorm th,1,136,20,1,1,0,0
7938,rain rain go away soaker way gt lt,0,111,14,0,1,0,0
7939,nathanfillion hardly,0,25,3,0,0,1,0
7940,tomorrows evening commute receives red light rainstorm impacting region push way late evening,1,140,20,1,1,0,0
7941,rainstorm didnt last nearly long enough,1,45,7,1,0,0,0
7943,robotrainstorm imsort interested fonts theyre using,0,68,9,1,0,0,0
7944,lizzie363 cstsmith drove thru deep water flash floodrainstorm repair cost 14000 25 yrs later people still thnk cars float,1,136,22,1,0,0,0
7945,best believe wrong decisions made memphis streets rainstorm lol folk doe,0,128,23,1,0,0,0
7949,want rainstorm please,0,29,6,1,0,0,0
7950,waking sick rainstorm outside would usually make sad today though put kooks stereo lets,0,136,26,1,0,0,0
7952,yay feel wind gearing rainstorm vancouver bring drought deadgrassandflowers wildfires,1,119,19,1,0,0,1
7953,robotrainstorm im huge football fan know ive never done fantasy leagues patience newbie,0,112,19,1,0,1,0
7954,way move like full rainstorm im house cards,1,71,16,1,0,0,0
7955,rainstorm destroys 600 houses yobe state,1,66,8,1,1,0,0
7957,way move like full rainstorm im house cards,0,70,16,1,0,0,0
7958,landslide caused severe rainstorm kills 3 italianåêalps,1,108,11,1,1,0,0
7959,former freedom surfspa razed make way new homes,0,78,11,1,1,0,0
7960,latest homes razed northern california wildfire abc news,1,94,13,1,1,0,0
7962,tension abia inec officeûªs razedåêûò governor ikpeazu pdp apga react,1,100,13,1,1,0,0
7963,latest homes razed northern california wildfire latest wildfires burning california andû,1,137,18,1,1,0,0
7965,latest homes razed northern california wildfire,1,108,12,1,1,0,0
7968,latest homes razed northern california wildfire abc news,1,94,13,1,1,0,0
7969,latest homes razed northern california wildfire abc news,1,94,13,1,1,0,0
7970,latest homes razed northern california wildfire lynchburg news advance,1,135,16,1,1,0,0
7971,news latest homes razed northern california wildfire new york times tafs fb100,1,122,18,1,1,0,1
7972,latest homes razed northern california wildfire abc news,1,94,13,1,1,0,0
7973,latest homes razed northern california wildfire abc news,1,94,13,1,1,0,0
7976,latest homes razed northern california wildfire,1,108,12,1,1,0,0
7977,latest homes razed northern california wildfire,1,108,12,1,1,0,0
7978,latest homes razed northern california wildfire,1,108,12,1,1,0,0
7980,petereallen huffpostuk bbc5live significant think iconic pic church maybe ruins less substantial efforts razed,0,138,20,1,0,1,0
7981,latest homes razed northern california wildfire,1,108,12,1,1,0,0
7982,latest homes razed northern california wildfire,1,108,12,1,1,0,0
7983,latest homes razed northern california wildfire abc news,1,94,13,1,1,0,0
7984,davidvonderhaar least sincere,1,45,7,0,0,1,0
7987,latest homes razed northern california wildfire abc news,1,94,13,1,1,0,0
7988,latest homes razed northern california wildfire abc news,1,94,13,1,1,0,0
7989,latest homes razed northern california wildfire,1,108,12,1,1,0,0
7990,homes razed northern calif wildfire sandiego,1,100,10,1,1,0,1
7991,george njenga hero saved burning friend razing wildfire,1,93,13,0,1,0,0
7992,today another dualcom imrazed enjoyed yesterdays check todays 5 pm easter,0,109,19,1,0,0,0
7994,latest homes razed northern california wildfire abc news gn,1,98,14,1,1,0,1
7996,latest homes razed northern california wildfire abc news,1,94,13,1,1,0,0
7999,latest homes razed northern california wildfire abc news,1,94,13,1,1,0,0
8000,latest homes razed northern california wildfire abc news,1,94,13,1,1,0,0
8001,latest homes razed northerncalifornia wildfire zippednews,1,118,11,1,1,0,1
8002,latest homes razed northern california wildfire,1,108,12,1,1,0,0
8003,george njenga hero saved burning friend razing wildfire,1,96,13,0,1,0,0
8005,latest homes razed northern california wildfire,1,108,12,1,1,0,0
8006,latest homes razed northern california wildfire abc news,1,94,13,1,1,0,0
8008,vassalboro house razed make way public gazebo petelmcguire reports,0,105,14,1,1,0,0
8009,justmarried turkish couple gave 4000 syrian refugees incredible gift fed instead family amp friends,1,142,19,1,1,0,0
8010,police monitoring 200 jihadis poland via freedomoutpost,1,82,9,0,1,0,0
8012,turkish newlyweds donate wedding money beautiful gesture still faith humanity,0,119,16,0,1,0,0
8013,justmarried turkish couple gave 4000 syrian refugees incredible gift washingtonpost,1,116,13,1,1,0,1
8015,repulsive refugeesvictimiserdutton evangelicalliarabbott co lnp dupe press overdrive choppergatebronwynbishopauspol,0,139,12,1,0,0,1
8016,retweet cameroon repatriating 12000 nigerian refugees due boko haram,1,101,12,1,1,0,1
8017,newlyweds feed syrian refugees wedding cbc news latest canada world entertainment business news,0,135,19,1,1,0,0
8018,wowo 12000 nigerian refugees repatriated cameroon,1,59,7,1,0,0,0
8019,hmm 12000 nigerian refugees repatriated cameroon,1,86,9,1,1,0,0
8020,whao 12000 nigerian refugees repatriated cameroon,1,89,9,1,1,0,0
8021,imagine entire aisle dedicated making people look like serbian refugees director whole foods clothing section,0,123,19,1,0,0,0
8023,viralspell couple spend wedding day feeding 4000 syrian refugees see,0,136,14,1,1,0,0
8024,reaad plsss 12000 nigerian refugees repatriated cameroon,1,62,8,1,0,0,0
8025,top story viralspell couple spend wedding day feeding 4000 syrian refugeesû see,0,136,15,1,1,0,0
8026,refugee connections indiegogo campaign going live tomorrow support us help launch online community refugees,1,135,20,1,0,0,1
8028,yall read 12000 nigerian refugees repatriated cameroon,1,83,9,1,1,0,0
8029,short throwing overboard dont think leader could much worse refugees tonyabbottmhr worst pm ever,1,139,23,1,0,0,1
8030,cameroon repatriated 12000 nigerian refugees,1,67,6,1,1,0,0
8031,captain abbott must go lnp boat refugees christianvalues,0,92,11,1,1,0,1
8032,turkish couple spent wedding day feeding 4000 syrian refugees turkish couple got marrie û,0,131,21,1,1,1,0
8034,one couple using drones save refugees worlds deadliest border,1,102,15,1,1,0,0
8035,whao 12000 nigerian refugees repatriated cameroon,1,89,9,1,1,0,0
8036,hmm 12000 nigerian refugees repatriated cameroon,1,86,9,1,1,0,0
8037,turkish couple decided feed 4000 syrian refugees part wedding celebrations,0,139,16,1,1,0,1
8038,fadelurker dalinthanelan lt right even two years still refugees camped south redcliffe village aidan gt,1,144,21,1,0,0,0
8039,newlyweds feed thousands syrian refugees instead hosting banquet wedding dinner age news,0,121,16,1,1,0,1
8040,photos young refugees forced flee burundis violence vice news see,1,131,17,1,1,0,0
8043,kristindavis un refugees thank un refugees helping many people need world û,0,141,21,1,1,0,0
8044,wowo 12000 nigerian refugees repatriated cameroon,0,59,7,1,0,0,0
8045,newlyweds feed thousands syrian refugees instead hosting banquet wedding dinner via smh,1,122,18,1,1,0,0
8047,pacic media centre articles australia rsf protests new security gag reporting,0,121,16,0,1,1,0
8049,recap 12000 nigerian refugees repatriated cameroon,1,79,8,1,1,0,0
8055,generous bride earth couple feeds 4000 syrian refugees wedding day via thedailybeast love,0,139,20,1,1,0,0
8056,whao 12000 nigerian refugees repatriated cameroon,1,89,9,1,1,0,0
8057,46 returned refugees fleeing amp vietnamese govt treat returned dutton presser,1,140,24,1,0,1,1
8058,chpsre rt refugees followers paris visit dream humanity exhibition rezaphotography û û,1,140,20,1,1,0,0
8060,policyholders object clico rescue plan,1,87,8,1,1,0,0
8061,dont panik kelbytomlinson rescue,0,66,7,1,1,0,1
8062,coastal german shepherd rescue oc shared link animalrescue,0,113,12,1,1,0,1
8064,ud rescue structural collapse scott road ypres road york 14 trucks,1,75,13,1,0,0,0
8065,rescue day itûªs world cat day saturday aug 8th black blackwhite cats 5 newbeginningsanimalrescue,0,137,18,1,1,0,1
8066,im 2 blood pressure meds still probably roof long ppact story broke involved animal rescue,0,137,25,1,0,0,1
8067,coastal german shepherd rescue oc shared link animalrescue,0,113,12,1,1,0,1
8068,coastal german shepherd rescue oc shared link ecstatic rescued racco animalrescue,0,112,13,1,1,0,1
8069,suggs amp vivian rescue psychrewatch,0,48,8,1,0,0,1
8070,lengths rescue cat need,0,59,9,1,1,0,0
8071,last chance animal rescue 3 new posts animalrescue,0,105,12,1,1,0,1
8073,last chance animal rescue 3 new posts animalrescue,0,105,12,1,1,0,1
8074,sammy todd always rescue may uniform still rescue lmao forever kfc fam,0,104,21,1,0,0,0
8079,lunch crew made night night long day peaceloverescue,0,82,14,1,0,0,0
8081,tell united nations plantations forests via rainforestresq,0,97,11,0,1,0,0
8083,mary coming troy rescue,0,58,7,1,1,1,0
8084,ud rescue structural collapse scott road ypres road york 14 trucks,1,75,13,1,0,0,0
8085,floodzone general raheel sharif visits chitral also lauded efforts fwo army troops army aviation rescue opera,1,135,24,1,0,0,0
8087,last chance animal rescue 3 new posts animalrescue,0,79,10,1,1,0,1
8088,lisavanderpump many dogs rescue dogs,0,71,13,1,0,1,0
8089,officials rescue 367 migrants libya 25 bodies found fox news news,1,96,14,1,1,0,1
8091,coastal german shepherd rescue oc shared link animalrescue,0,113,12,1,1,0,1
8094,zakbagans sabrina dad rescued dude kept cage weve since 4,1,136,25,1,1,0,0
8095,britons rescued amid himalaya floods,1,107,8,1,1,0,0
8096,4 kidnapped ladies rescued police enugu nigerian tribune,1,87,12,1,1,0,0
8097,rescued med migrants arrive sicily,1,60,7,1,1,0,0
8098,tennoatax hand glass water sit rescued tenno ive lived ship around dojo year,0,138,29,1,0,0,0
8100,trust us get rescued dopey ones val hilarious shame shes probably going die emmerdale,0,106,19,1,0,0,1
8101,summer summervibes california puppy pitmix rescued brixton banksy happy mybabies,0,113,11,1,1,0,1
8102,man buried dog alive thought one would find rescued time,0,110,19,1,1,0,0
8103,10monthold baby girl rescued coastguard floated half mile sea socialnews,1,125,18,1,1,0,1
8105,skyrim awaits rescuedagain,0,45,7,1,0,0,1
8106,rescued med migrants arrive sicily,1,60,7,1,1,0,0
8109,finnish hip hop pioneer paleface rescued drifting raft brought container later enkelbiljett menolippu,0,137,21,1,0,0,1
8110,18 bovines rescued 3 smugglersåênabbed,1,61,6,1,1,0,0
8111,funds needed rescued abandoned cocker spaniels,0,78,9,1,1,0,0
8112,liked youtube video romanatwoodvlogs rescued sick kittens,0,89,11,1,1,0,0
8113,news britons rescued amid himalaya floods,1,65,7,1,1,0,1
8116,brave little dog gets rescued river recovery inspi via youtube,0,112,17,1,1,0,0
8118,homeless man traveling across usa 11 stray dogs rescued gets helping hand strangers via reshareworthy,0,140,20,1,1,0,0
8119,brittanypetko breaking news tonight kids rescued play room week food water parents sex life haha,1,132,24,1,0,0,0
8120,rescued actually pretend giorgio hiatt,0,107,20,1,0,0,0
8121,rescued dog least 9 years ago shes old still sweet ever zakbagans,0,113,20,1,1,1,0
8122,rescued med migrants arrive sicily hundreds migrants rescuedû,1,116,12,1,1,0,0
8125,werent taken back africa rescued c4news,1,59,10,1,0,1,1
8126,migrants rescued boat capsizes libya,1,69,8,1,1,0,0
8128,young children among rescued capsized boat libya via irishtimesworld,1,107,13,1,1,0,0
8129,heroes springer spaniel amp dog dad rescued stranded baby dolphin,1,123,15,1,1,0,0
8130,trust us get rescued dopey ones emmerdale summerfate,0,67,13,1,0,0,1
8131,three beached whales rescued kerry,1,62,8,1,1,0,0
8133,rescued tb goes ribbon hits via offtrackhorse,0,79,11,1,1,0,0
8135,turn back rescued swept away sins though clouds isaiah 4422 contemporary english version,0,130,23,1,0,0,0
8136,zakbagans pets r like part family love animals last 2 pets rescued breaks heart animals mistreated,0,143,26,1,0,1,0
8137,liked youtube video homeless dog living cardboard box gets rescued amp heartwarming,0,124,19,1,1,0,0
8138,angry mistrustful rescued elephant finds peace friendship new home photos via onegreenplanet,0,129,16,1,1,0,0
8140,photo hundreds rescued migrants await disembarkment irish naval vessel palermo italy tconnellyrû,1,140,18,1,1,0,0
8141,rescued med migrants arrive sicily,1,60,7,1,1,0,0
8142,video picking bodies water rescuers searching hundreds migrants africa news,1,136,19,1,1,0,1
8143,video picking bodies water rescuers searching hundreds migrants mediterran,1,136,18,1,1,0,0
8144,video picking bodies water rescuers searching hundreds migrants mediterran,1,136,18,1,1,0,0
8146,video picking bodies water rescuers searching hundreds migrants mediterran,1,136,18,1,1,0,0
8147,video picking bodies water rescuers searching hundreds migrants mediterranean,1,140,19,1,1,0,0
8149,world fears missing migrants med rescuers search survivors boat carrying many news,1,136,20,1,1,0,1
8150,durbanknight rescuers searching hundreds migrants mediterranean boat carr nosybe,1,136,17,1,1,0,0
8154,unexplainable desire watch rescuers childhooddefined,0,71,10,1,0,0,1
8155,roddypiperautos fears missing migrants med rescuers search survivors boat carrying,1,137,19,1,1,0,1
8156,andygilder channel 5 rspca dog rescuersthe infomercial crept back door,0,128,21,1,0,0,0
8158,video picking bodies water rescuers searching hundreds migrants mediterranean boat carryi,1,136,21,1,0,0,0
8159,womanûªs gps app guides rescuers injured biker marin county,1,89,12,1,1,0,0
8161,video picking bodies water rescuers searching hundreds migrants mediterran,1,136,18,1,1,0,0
8162,video picking bodies water rescuers searching hundreds migrants mediterran,1,136,18,1,1,0,0
8163,video picking bodies water rescuers searching hundreds migrants mediterranean boat carryi,1,136,21,1,0,0,0
8164,video picking bodies water rescuers searching hundreds migrants africa news,1,136,19,1,1,0,1
8165,last second ebay bid rt shaolin rescuers dvd 2010 shen chan nan chiang five venoms kung fu please favori,0,131,20,1,1,1,0
8168,video picking bodies water rescuers searching hundreds migrants mediterranean boat carryi,1,136,21,1,0,0,0
8169,worldnews video picking bodies water bbc news home rescuers searching hundreds,1,138,19,1,1,0,1
8170,video picking bodies water rescuers searching hundreds migrants mediterran,1,136,18,1,1,0,0
8171,video picking bodies water rescuers searching hundredsû,1,129,14,1,1,0,0
8172,ahmazing story power animal rescuers starving homeless dog future rescued person,1,139,21,1,1,0,0
8175,rescuers searching hundreds migrants mediterranean boat carrying many 600 people capsized coast ofû,1,141,24,1,0,0,0
8176,news many deaths shipwreck rescuers trying save hundreds migrants via thenewshype,1,136,18,1,1,0,1
8177,video picking bodies water rescuers searching hundreds migrants mediterran,1,136,18,1,1,0,0
8180,video picking bodies water rescuers searching hundreds migrants mediterran,1,136,18,1,1,0,0
8181,rescuers found barely alive idea allergic,1,113,19,1,1,0,0
8182,fears missing migrants med rescuers search survivors boat carrying many 600 migrant,1,136,20,1,1,0,0
8183,video picking bodies water rescuers searching hundreds migrants mediterranean boat carryi,1,136,21,1,0,0,0
8184,womans gps app guides rescuers injured biker marin county sfgate,1,96,14,1,1,0,0
8187,fears missing migrants med rescuers search survivors boat carrying many 600 migrantsû,1,137,20,1,1,0,0
8188,rescuers find survivors nepal earthquake buried,1,77,9,1,1,0,0
8189,rescuers recover body 37yearold calgary man lake near vulcan û,1,140,54,1,1,0,0
8190,fears missing migrants med rescuers search survivors boat carrying many 600 migrantsû,1,137,20,1,1,0,0
8191,video picking bodies water rescuers searching hundreds migrants bbc news,1,136,19,1,1,0,1
8195,meatloving feminists world riot grill arrived pop quiz prefer fem art,0,135,21,0,1,0,1
8196,stuart broad takes eight joe root runs riot aussies,0,66,11,0,0,0,0
8201,piprhys predict riot,1,26,5,0,0,0,0
8202,teamvodg discovered nickcannon listenbuy realmandyrain riot itunesmusic itunes û blowmandyup,0,134,14,0,1,0,1
8203,meatloving feminists world riot grill arrived arts,0,120,15,0,1,0,1
8204,rascal flatts riot tour atlantic city beach concertaugust 20 20152 tickets,0,122,13,0,1,0,0
8205,meatloving feminists world riot grill hasåêarrived,0,92,12,0,1,0,0
8208,seriously tactical riot headquarters disney marvel,0,91,16,0,0,0,0
8209,daniriot keep eye well looking lots new team members coming daysweeks,0,96,18,0,0,0,0
8210,meatloving feminists world riot grill arrived pop quiz prefer feminist,0,135,20,0,1,0,0
8211,liveworkshop selfie booth riot kappa,1,44,7,0,0,0,0
8212,acaciapenn ill start big ass riot send jail today mfs shidddd,0,75,16,0,0,1,0
8213,riot kit bah part new concept gear coming autumnwinter menswear fashion urbanfashionû,0,128,16,0,1,0,1
8214,abrancaballero discovered nickcannon listenbuy realmandyrain riot itunesmusic itunes û blowmandyup,0,141,14,0,1,0,1
8215,liked youtube video thorins thoughts riot sandbox mode lol,0,95,14,0,1,0,0
8216,stuart broad takes eight joe root runs riot aussies stuart broad took careerbest figures 8,0,136,19,0,1,0,0
8217,retweeted sarah silverman sarahksilverman soundtrack walk starts w tracey ullman dont know perfect,0,117,16,0,0,0,0
8218,meatloving feminists world riot grill arrived,1,91,13,0,1,0,0
8219,time riot really make official satan teemo skin,0,95,14,0,1,0,0
8221,liked youtube video sick riot shield slide spots,0,78,11,0,1,0,0
8223,bytorrecilla torrecilla always info secret lol game check secret get 600000 riot points bio,0,116,21,0,0,0,0
8224,transwomen drag queens color lead riot well known butch lesbian usually credited inciting,0,113,20,0,0,0,0
8225,eac4au preorder film itunes amp watch 915 yay,0,141,16,0,1,0,0
8226,without ally near cant use skill get hired really cause making every riot staff member look incompetent,0,138,24,0,0,1,0
8231,pop quiz prefer feminist revolution fried ravioliåêwith porcini ricottaû,0,142,16,0,1,0,0
8232,meatloving feminists world riot grill arrived oliviamiles01,0,105,14,0,1,0,0
8234,davidjordan88 stephanenny except dont know started riot even makes sense credit particular individuals,1,135,21,0,0,0,0
8235,trollkrattos juan carlos salvador secret tips get 100000 riot points lol check secret bio,0,124,23,0,0,0,0
8236,southeast dirt riot series crowns champions southeast dirt riot series crowns championsblackfoot id,0,135,17,0,1,0,0
8237,sweetpeas running riot allotment brightening rainy day,1,100,15,0,1,0,0
8238,stuart broad takes eight joe root runs riot aussies,0,66,11,0,0,0,0
8239,riot police intervene southampton vitesse arnhem supporters clash û¢ fans clash buildup second,1,138,18,0,1,0,0
8240,jwalkerlyle discovered nickcannon listenbuy realmandyrain riot itunesmusic itunes û blowmandyup,0,137,14,0,1,0,1
8241,cracker white riot nowplaying,0,59,8,0,1,1,1
8242,government care police stop rioting eventually protestors eventually skyscrapers become plantcovered,1,135,19,1,0,0,0
8243,new doco tonight 9pm setanta sports ireland freeview largest police presence soccer game ireland stop prevent rioting,0,137,23,1,0,0,0
8244,eric clapton shot sheriff 1974 guess many people rioting right none,1,89,16,1,0,1,0
8245,kill val im rioting emmerdale,0,43,8,1,0,0,1
8246,money cant buy happiness lie tell poor people keep rioting,1,88,17,1,0,0,0
8247,bloody hell already upgraded rioting hyperbole saintsfc,1,73,10,1,0,0,1
8250,twitter count rioting financial collapse brazil rio2016,1,109,16,1,1,0,1
8251,would black dude antioch would rioting,0,59,12,1,0,0,0
8252,runjewels recently met bbc discuss race relations america amp benefits rioting loveislove,0,143,19,1,1,0,1
8253,reuters people like charged inevitable rioting contributing lies,0,109,18,1,0,0,0
8254,cindy noonancindynoonanheartbreak baltimore rioting yahistorical undergroundrailraod,1,117,9,1,1,0,1
8256,leeds fan rioting embra lower tier league cup final dee dum,1,76,15,1,0,0,0
8257,still rioting couple hours left class,1,72,16,1,0,0,0
8258,cloydrivers plenty black people rioting tosu championship well,0,94,15,1,0,0,0
8259,evacide ferguson riots worked next time say rioting doesnt change anything fixed,1,128,21,1,0,0,0
8261,bbcnews ass british insurers says rioting cost insurers amp163163millions police numbers reduced blind fat contr,1,144,22,1,0,0,1
8262,bhramabull watch run jewels use facts defend rioting ferguson socially minded duo takes,1,136,20,1,1,0,1
8264,think twitter invented keep us insomniacs rioting wee small hours,0,87,16,1,0,0,0
8266,blutz10 people arent rioting justice served murderer behind bars simple justiceno peace justicepeace,1,139,20,1,0,0,0
8267,still rioting gmail,0,28,5,1,0,0,0
8270,jasalhad brianboru67 jimskiv92 hijinks1967 rioting,1,55,5,1,0,0,0
8271,ryleedowns02 nevaehburton33 dont get money tomorrow rioting,0,76,12,1,0,1,0
8274,rt sweden isnt venezuela days rioting venezuela riots directed grû,1,139,23,1,1,0,0
8276,davidolszak rioting happy valley penn state loses,0,67,11,1,0,1,0
8278,aelinrhee group mascara smeared girls rioting horrific think,1,76,13,1,0,0,0
8279,last time high profile name due signing nffc city rioting wesley verhoek household name dontpanic,1,136,25,1,0,0,1
8280,georgous alternatives legal alternatives protesting rioting may peaceful thing demonstration,0,137,20,1,0,1,0
8283,halljh1720 sick criminals parents friends rioting killed police dont give damn officer,1,137,25,1,0,0,0
8284,blutz10 rioting began prior decision indictment youre really making sense pointû,1,122,21,1,0,0,0
8285,ashes test match currently interesting stupid congress rioting,1,82,12,1,0,0,0
8286,people rioting everywhere think id one usamisan lt3,1,75,12,1,0,0,0
8287,football hooligan jailed rioting game scotland already banned matches england uknews,1,134,18,1,1,0,1
8288,cindy noonancindynoonanheartbreak baltimore rioting yahistorical undergroundrailraod,0,117,9,1,1,0,1
8289,bbcnews ass british insurers says rioting cost insurers163millions police numbers reduced blind fat controllers,1,138,20,1,0,0,0
8291,fa07af174a71408 lived amp family lived countries looters shot sight rioting wasnt tolerated,1,143,23,1,0,0,0
8292,refuse let life reduced rubble shit keeps piling get shovel expirehc,0,99,19,1,0,0,0
8294,chinas stock market crash gems rubble chinaûªs stock market crash su via forbes,0,138,21,1,1,1,0
8295,go nuclear arms race going make rubble bounce winston churchill,0,113,23,1,0,1,0
8296,accionempresa chinaûªs stock market crash summer sparked interest bargain hunt gerenciatodos å¨,1,138,16,0,1,0,0
8297,accionempresa chinaûªs stock market crash summer sparked interest bargain hunt gerenciatodos å¨,0,138,16,0,1,0,0
8298,parents impulsive sometimes remember coming home room filled dust amp rubble wanted redesigned,0,145,25,1,0,1,0
8300,turning rubble disasters lego bricks build houses one belongs crazyideascollege,0,138,18,1,1,0,1
8301,360wisenews chinas stock market crash gems rubble,0,95,13,1,1,1,1
8304,forbes chinas stock market crash gems rubble chinaûªs stock market crash summer ha,0,138,19,1,1,1,0
8309,forbes europe chinas stock market crash gems rubble,1,96,13,1,1,1,1
8310,chinaûªs stock market crash summer sparked interest bargain hunters bulls betting rebound dû,0,142,20,0,1,0,0
8311,jasonpope2 johnfugelsang didnt say referring main 2 buildings 7 hit rubble,1,114,21,1,0,0,0
8312,chinas stock market crash gems rubble,0,80,11,1,1,1,0
8314,360wisenews chinas stock market crash gems rubble,1,95,13,1,1,1,1
8315,jun 2015 yemenis search survivors rubble houses old city sanûªa following,1,131,20,1,1,0,0
8317,chinas stock market crash gems rubble forbesasia,1,92,12,1,1,1,1
8318,steve buscemi firefightr b4 fame amp workd 12hr shifts diggin thru wtc rubble lookg 4 survivors,1,127,19,1,1,0,0
8320,chinas stock market crash gems rubble tcot p2 news,0,96,14,1,1,1,1
8321,chinas stock market crash gems rubble chinaûªs stock market crash summer h forbes,0,138,20,1,1,1,0
8324,found diamond rubble,0,31,7,1,0,0,0
